du_an,price_VND,location,status,area,price_m2,toilet,room,doc,type,Số tầng,furnishing
,2.6,"Đường đê Vàng, Xã Cổ Bi, Huyện Gia Lâm, Hà Nội",,48.6,53.5,,,Đã có sổ,Đất thổ cư,,
,1.9,"Vệ Linh, Xã Xuân Thu, Huyện Sóc Sơn, Hà Nội",,83.0,22.89,,,Đã có sổ,Đất thổ cư,,
,3.5,"Thôn 2, Phú Cát, Xã Phú Cát, Huyện Quốc Oai, Hà Nội",,310.3,11.28,,,Đã có sổ,Đất thổ cư,,
,1.86,"Tranh khúc, Xã Duyên Hà, Huyện Thanh Trì, Hà Nội",,48.0,38.75,,,Đã có sổ,Đất thổ cư,,
,7.35,"Đường Đa Sỹ, Phường Hà Cầu, Quận Hà Đông, Hà Nội",,34.0,216.18,,,Đã có sổ,Đất thổ cư,,
,10.5,"Văn Hội, Phường Đức Thắng, Quận Bắc Từ Liêm, Hà Nội",,61.0,172.13,,,Đã có sổ,Đất thổ cư,,
,3.5,"Cụm 9, Xã Hồng Hà, Huyện Đan Phượng, Hà Nội",,62.5,56.0,,,Đã có sổ,Đất thổ cư,,
,24.0,"Đường Nguyễn Văn Huyên, Phường Nghĩa Đô, Quận Cầu Giấy, Hà Nội",,73.0,328.77,,,Đã có sổ,Đất thổ cư,,
,3.0,"Vạn Phúc 3, Xã Vạn Phúc, Huyện Thanh Trì, Hà Nội",,58.0,51.72,,,Đã có sổ,Đất thổ cư,,
,5.85,"Đường Nguyễn Văn Cừ, Phường Bồ Đề, Quận Long Biên, Hà Nội",,54.0,108.33,,,Đã có sổ,Đất thổ cư,,
du_an,price_VND,location,status,area,price_m2,toilet,room,doc,type,Số tầng,furnishing
,2.2,"Đường cao tốc Vành đai 3, Phường Lĩnh Nam, Quận Hoàng Mai, Hà Nội",,30.0,73.33,,,Đã có sổ,Đất thổ cư,,
,6.2,"Phố Ô Cách, Phường Việt Hưng, Quận Long Biên, Hà Nội",,47.3,131.08,,,Đã có sổ,Đất thổ cư,,
,8.9,"An Vượng, Phường Dương Nội, Quận Hà Đông, Hà Nội",,50.0,178.0,,,Đã có sổ,Đất thổ cư,,
,4.05,"Tả Thanh Oai, Xã Tả Thanh Oai, Huyện Thanh Trì, Hà Nội",,41.0,98.78,,,Đã có sổ,Đất thổ cư,,
,4.2,"Thôn Hoà Lạc, Xã Bình Yên, Huyện Thạch Thất, Hà Nội",,83.2,50.48,,,Đã có sổ,Đất thổ cư,,
,1.2,"Đông Nam, Xã Nam Phương Tiến, Huyện Chương Mỹ, Hà Nội",,63.0,19.05,,,Đã có sổ,Đất thổ cư,,
,2.58,"Đường Nguyễn Khoái, Phường Thanh Trì, Quận Hoàng Mai, Hà Nội",,40.0,64.5,,,Đã có sổ,Đất thổ cư,,
,1.2,"Tự Nhiên, Xã Tự Nhiên, Huyện Thường Tín, Hà Nội",,43.0,27.91,,,Đã có sổ,Đất thổ cư,,
,0.97,"Bạch Hạ, Xã Bạch Hạ, Huyện Phú Xuyên, Hà Nội",,60.0,16.17,,,Đã có sổ,Đất thổ cư,,
,25.8,"Ngọc Hồi, Xã Ngọc Hồi, Huyện Thanh Trì, Hà Nội",,215.0,120.0,,,Đã có sổ,Đất thổ cư,,
,12.9,"Đường Phúc Lợi, Phường Phúc Lợi, Quận Long Biên, Hà Nội",,86.0,150.0,,,Đã có sổ,Đất thổ cư,,
,6.2,"68, đường.., Xã Ngọc Hồi, Huyện Thanh Trì, Hà Nội",,80.2,77.31,,,Đã có sổ,Đất thổ cư,,
,4.6,"Đường Phúc Lợi, Phường Phúc Lợi, Quận Long Biên, Hà Nội",,40.0,115.0,,,Đã có sổ,Đất thổ cư,,
,7.8,"Đường Phúc Lợi, Phường Phúc Lợi, Quận Long Biên, Hà Nội",,100.0,78.0,,,Đã có sổ,Đất thổ cư,,
,0.16,"Đường an trai, Xã Vân Canh, Huyện Hoài Đức, Hà Nội",,50.4,3.17,,,Đã có sổ,Đất thổ cư,,
,21.0,"Ngõ 8 Đường An Trai, Xã Vân Canh, Huyện Hoài Đức, Hà Nội",,147.0,142.86,,,Đã có sổ,Đất thổ cư,,
,7.808,"422, Xã Lại Yên, Huyện Hoài Đức, Hà Nội",,64.0,122.0,,,Đã có sổ,Đất thổ cư,,
,16.6,"An trai , Xã Vân Canh, Huyện Hoài Đức, Hà Nội",,100.0,166.0,,,Đã có sổ,Đất thổ cư,,
,7.5,"Phố Việt Hưng, Phường Việt Hưng, Quận Long Biên, Hà Nội",,75.0,100.0,,,Đã có sổ,Đất thổ cư,,
,3.05,"Đường Kiên Thành, Thị trấn Trâu Quỳ, Huyện Gia Lâm, Hà Nội",,30.0,101.67,,,Đã có sổ,Đất thổ cư,,
,4.65,"Ngõ 303 Phúc Lợi, Phường Phúc Lợi, Quận Long Biên, Hà Nội",,55.0,84.55,,,Đã có sổ,Đất thổ cư,,
,8.0,"Đường Đức Diễn, Phường Phúc Diễn, Quận Bắc Từ Liêm, Hà Nội",,57.0,140.35,,,Đã có sổ,Đất thổ cư,,
,3.1,"Dân Sinh, Thị trấn Quang Minh, Huyện Mê Linh, Hà Nội",,56.6,54.77,,,Đã có sổ,Đất thổ cư,,
,1.41,"Chương Lộc, Xã Chương Dương, Huyện Thường Tín, Hà Nội",,45.0,31.33,,,Đã có sổ,Đất thổ cư,,
,4.35,"Đường Dương Quang, Xã Dương Xá, Huyện Gia Lâm, Hà Nội",,68.5,63.5,,,Đã có sổ,Đất thổ cư,,
,10.26,"Sen Phương , Xã Sen Chiểu, Huyện Phúc Thọ, Hà Nội",,360.0,28.5,,,Đã có sổ,Đất thổ cư,,
,4.35,"Đường Dương Quang, Xã Dương Xá, Huyện Gia Lâm, Hà Nội",,68.5,63.5,,,Đã có sổ,Đất thổ cư,,
,31.5,"Đường Bát Khối, Phường Cự Khối, Quận Long Biên, Hà Nội",,120.0,262.5,,,Đã có sổ,Đất nền dự án,,
,1.8,"Ngọc Hồi, Xã Vạn Phúc, Huyện Thanh Trì, Hà Nội",,40.0,45.0,,,Đã có sổ,Đất thổ cư,,
,2.5,"Vạn Phúc - Đông Mỹ, Xã Vạn Phúc, Huyện Thanh Trì, Hà Nội",,1000.0,2.5,,,Đã có sổ,Đất thổ cư,,
,12.2,"Phố Nguyễn Thời Trung, Phường Thạch Bàn, Quận Long Biên, Hà Nội",,58.0,210.34,,,Đã có sổ,Đất nền dự án,,
,12.5,"Đường Thạch Bàn, Phường Thạch Bàn, Quận Long Biên, Hà Nội",,51.0,245.1,,,Đã có sổ,Đất nền dự án,,
,0.95,"Thôn Kim Đái 2, Không Có Tên Đường, Xã Kim Sơn, Thị xã Sơn Tây, Hà Nội",,60.0,15.83,,,Đã có sổ,Đất thổ cư,,
,6.27,"Thanh Am, Thượng Thanh, Long Biên, Thanh Am,Thượng Thanh, Long Biên, HÀ Nội, Phường Long Biên, Quận Long Biên, Hà Nội",,66.0,95.0,,,Đã có sổ,Đất thổ cư,,
,9.7,"Đường Giáp Bát, Phường Giáp Bát, Quận Hoàng Mai, Hà Nội",,55.0,176.36,,,Đã có sổ,Đất thổ cư,,
,1.83,"Thanh Trí, Xã Minh Phú, Huyện Sóc Sơn, Hà Nội",,110.5,16.56,,,Đã có sổ,Đất thổ cư,,
,6.98,"Phố Giang Biên, Phường Giang Biên, Quận Long Biên, Hà Nội",,56.0,124.64,,,Đã có sổ,Đất thổ cư,,
,10.5,"60, Phố Đức Giang, Phường Đức Giang, Quận Long Biên, Hà Nội",,60.0,175.0,,,Đã có sổ,Đất thổ cư,,
,4.5,"Ngô Gia Tự, Phường Thượng Thanh, Quận Long Biên, Hà Nội",,50.0,90.0,,,Đã có sổ,Đất thổ cư,,
,5.7,"Khu 1ha, Đường Vạn Xuân, Thị trấn Trạm Trôi, Huyện Hoài Đức, Hà Nội",,37.6,151.6,,,Đã có sổ,Đất thổ cư,,
,10.5,"60, Phố Đức Giang, Phường Đức Giang, Quận Long Biên, Hà Nội",,60.0,175.0,,,Đã có sổ,Đất thổ cư,,
,4.5,"Ngô Gia Tự, Phường Thượng Thanh, Quận Long Biên, Hà Nội",,50.0,90.0,,,Đã có sổ,Đất thổ cư,,
,5.7,"Khu 1ha, Đường Vạn Xuân, Thị trấn Trạm Trôi, Huyện Hoài Đức, Hà Nội",,37.6,151.6,,,Đã có sổ,Đất thổ cư,,
,18.0,"Phố Bà Triệu, Phường Hà Cầu, Quận Hà Đông, Hà Nội",,60.0,300.0,,,Đã có sổ,Đất thổ cư,,
,5.5,"Định Công, Phường Định Công, Quận Hoàng Mai, Hà Nội",,45.0,122.22,,,Đã có sổ,Đất thổ cư,,
,2.17,"Liễu Ngoại, Xã Khánh Hà, Huyện Thường Tín, Hà Nội",,43.3,50.12,,,Đã có sổ,Đất thổ cư,,
,3.64,"Quốc lộ 6, Thị trấn Xuân Mai, Huyện Chương Mỹ, Hà Nội",,280.0,13.0,,,Đã có sổ,Đất thổ cư,,
,1.8,"tân mỹ, Xã Thụy Hương, Huyện Chương Mỹ, Hà Nội",,44.7,40.27,,,Đã có sổ,Đất thổ cư,,
,8.5,"Đường Vạn Phúc, Phường Vạn Phúc, Quận Hà Đông, Hà Nội",,51.0,166.67,,,Đã có sổ,Đất thổ cư,,
,2.45,"Mặt Đường uBND Chương Dương, Xã Chương Dương, Huyện Thường Tín, Hà Nội",,81.8,29.95,,,Đã có sổ,Đất thổ cư,,
,1.536,"Ngã 3 DÂU, Xã Xuân Canh, Huyện Đông Anh, Hà Nội",,256.0,6.0,,,Đã có sổ,Đất nông nghiệp,,
,2.6,"Đường Lâm Trường, Xã Minh Phú, Huyện Sóc Sơn, Hà Nội",,209.0,12.44,,,Đã có sổ,Đất thổ cư,,
Khu nhà ở Phú Thượng,6.5,"An Dương Vương, Phường Phú Thượng, Quận Tây Hồ, Hà Nội",,50.0,130.0,,,Đã có sổ,Đất thổ cư,,
,11.5,"Đường Cổ Linh, Phường Thạch Bàn, Quận Long Biên, Hà Nội",,69.0,166.67,,,Đã có sổ,Đất nền dự án,,
,2.0,"uỷ ban hiệp thuận, Xã Hiệp Thuận, Huyện Phúc Thọ, Hà Nội",,55.0,36.36,,,Đã có sổ,Đất thổ cư,,
,2.0,"Trục Chính Thôn , Xã Nam Phương Tiến, Huyện Chương Mỹ, Hà Nội",,270.0,7.41,,,Đã có sổ,Đất thổ cư,,
,29.0,"Đường Nguyễn Xiển, Phường Hạ Đình, Quận Thanh Xuân, Hà Nội",,80.0,362.5,,,Đã có sổ,Đất thổ cư,,
,2.5,"Thôn Phương Bản, Xã Phụng Châu, Huyện Chương Mỹ, Hà Nội",,52.0,48.08,,,Đã có sổ,Đất thổ cư,,
,6.417,Đường trung tâm,,142.6,45.0,,,Đã có sổ,Đất thổ cư,,
,4.0,"cự khối, Phường Cự Khối, Quận Long Biên, Hà Nội",,83.0,48.19,,,Đã có sổ,Đất thổ cư,,
du_an,price_VND,location,status,area,price_m2,toilet,room,doc,type,Số tầng,furnishing
,29.0,"Đường Nguyễn Xiển, Phường Hạ Đình, Quận Thanh Xuân, Hà Nội",,80.0,362.5,,,Đã có sổ,Đất thổ cư,,
,2.5,"Thôn Phương Bản, Xã Phụng Châu, Huyện Chương Mỹ, Hà Nội",,52.0,48.08,,,Đã có sổ,Đất thổ cư,,
,6.417,Đường trung tâm,,142.6,45.0,,,Đã có sổ,Đất thổ cư,,
,4.0,"cự khối, Phường Cự Khối, Quận Long Biên, Hà Nội",,83.0,48.19,,,Đã có sổ,Đất thổ cư,,
,2.527,"Đường Bắc Cầu, Phường Ngọc Thụy, Quận Long Biên, Hà Nội",,36.1,70.0,,,Đã có sổ,Đất thổ cư,,
,1.75,"21, Xã Kim Thư, Huyện Thanh Oai, Hà Nội",,40.0,43.75,,,Đã có sổ,Đất thổ cư,,
,7.8,"Phố Trần Đăng Khoa, Phường Long Biên, Quận Long Biên, Hà Nội",,30.0,260.0,,,Đã có sổ,Đất thổ cư,,
,20.3,"Đường Lạc Long Quân, Phường Nhật Tân, Quận Tây Hồ, Hà Nội",,78.0,260.26,,,Đã có sổ,Đất thổ cư,,
,4.4,"Đồng tre, Lỗ gió, Xã Võng Xuyên, Huyện Phúc Thọ, Hà Nội",,136.0,32.35,,,Đã có sổ,Đất thổ cư,,
,18.7,"Đường Bát Khối, Phường Cự Khối, Quận Long Biên, Hà Nội",,122.0,153.28,,,Đã có sổ,Đất nền dự án,,
,0.9,"Đường Tả Thanh Oai, Xã Tả Thanh Oai, Huyện Thanh Trì, Hà Nội",,66.0,0.013635999999999999,,,Sổ chung / công chứng vi bằng,Đất nông nghiệp,,
,4.6,"Đường Bát Khối, Phường Cự Khối, Quận Long Biên, Hà Nội",,40.0,115.0,,,Đã có sổ,Đất thổ cư,,
,7.0,"Dt429b, Xã Viên An, Huyện Ứng Hòa, Hà Nội",,1063.3,6.58,,,Đã có sổ,Đất nông nghiệp,,
,3.2,"Phố Minh Khai, Phường Minh Khai, Quận Hai Bà Trưng, Hà Nội",,30.0,106.67,,,Đã có sổ,Đất thổ cư,,
,11.4,"Đường Thạch Bàn, Phường Thạch Bàn, Quận Long Biên, Hà Nội",,65.0,175.38,,,Đã có sổ,Đất nền dự án,,
,7.5,"Đường Xuân Phương, Phường Xuân Phương, Quận Nam Từ Liêm, Hà Nội",,55.0,136.36,,,Đã có sổ,Đất thổ cư,,
,2.199,"268, Ngõ 266 Lê Hữu Tựu, Xã Nguyên Khê, Huyện Đông Anh, Hà Nội",,40.0,54.98,,,Đã có sổ,Đất thổ cư,,
,6.3,"thôn Sáp Mai, Xã Võng La, Huyện Đông Anh, Hà Nội",,90.0,70.0,,,Đã có sổ,Đất thổ cư,,
,1.9,"5, Phố Do Nha, Phường Tây Mỗ, Quận Nam Từ Liêm, Hà Nội",,42.0,45.24,,,Sổ chung / công chứng vi bằng,Đất thổ cư,,
,11.4,"Trục chính thôn Hội Phụ, Xã Đông Hội, Huyện Đông Anh, Hà Nội",,120.0,95.0,,,Đã có sổ,Đất thổ cư,,
,5.7,"Đường Bát Khối, Phường Cự Khối, Quận Long Biên, Hà Nội",,37.0,154.05,,,Đã có sổ,Đất thổ cư,,
,8.24,"07, Hẻm 29 Ngách 48 Ngõ 28 Phố Chu Huy Mân, Phường Phúc Đồng, Quận Long Biên, Hà Nội",,103.0,80.0,,,Đã có sổ,Đất thổ cư,,
,10.9,"Đường Mỹ Đình, Phường Mỹ Đình 1, Quận Nam Từ Liêm, Hà Nội",,52.0,209.62,,,Đã có sổ,Đất thổ cư,,
,3.85,"Phố Thanh Am, Phường Thượng Thanh, Quận Long Biên, Hà Nội",,30.0,128.33,,,Đã có sổ,Đất thổ cư,,
,4.0,"CNC Công nghệ cao hoà lạc , Xã Hạ Bằng, Huyện Thạch Thất, Hà Nội",,90.0,44.44,,,Đã có sổ,Đất thổ cư,,
,8.35,"Đường Cổ Linh, Phường Thạch Bàn, Quận Long Biên, Hà Nội",,61.0,136.89,,,Đã có sổ,Đất thổ cư,,
,3.95,"777, Đường Nguyễn Khoái, Phường Thanh Trì, Quận Hoàng Mai, Hà Nội",,55.0,71.82,,,Đã có sổ,Đất thổ cư,,
,1.065,"Ngõ 44 Phố Ngô Quyền Thị Xã Son Tây Hả Nội , Phường Ngô Quyền, Thị xã Sơn Tây, Hà Nội",,36.7,29.02,,,Đã có sổ,Đất thổ cư,,
,6.15,"Khu đất đấu giá- Dịch vụ nguyễn trãi, Xã Nguyễn Trãi, Huyện Thường Tín, Hà Nội",,161.0,38.2,,,Đã có sổ,Đất thổ cư,,
,2.975,"446, Xã Phú Mãn, Huyện Quốc Oai, Hà Nội",,175.0,17.0,,,Đã có sổ,Đất thổ cư,,
,1.35,"Nội Khu, Xã Đông Sơn, Huyện Chương Mỹ, Hà Nội",,60.0,22.5,,,Đã có sổ,Đất thổ cư,,
,6.0,"429, Xã Phượng Dực, Huyện Phú Xuyên, Hà Nội",,200.0,30.0,,,Đã có sổ,Đất thổ cư,,
,4.9,"Đường Kính Nỗ, Xã Xuân Nộn, Huyện Đông Anh, Hà Nội",,61.2,80.07,,,Đã có sổ,Đất thổ cư,,
,2.0,"Đường Quốc lộ 32, Xã Tích Giang, Huyện Phúc Thọ, Hà Nội",,55.5,36.04,,,Đã có sổ,Đất thổ cư,,
,5.8,"Bắc Hồng, Xã Bắc Hồng, Huyện Đông Anh, Hà Nội",,101.6,57.09,,,Đã có sổ,Đất thổ cư,,
,6.0,"Đường Thụy Khuê, Phường Thụy Khuê, Quận Tây Hồ, Hà Nội",,38.0,157.89,,,Đã có sổ,Đất thổ cư,,
,2.15,"Chúc sơn, Thị trấn Chúc Sơn, Huyện Chương Mỹ, Hà Nội",,45.0,47.78,,,Đã có sổ,Đất thổ cư,,
,3.8,"Phố Guột , Xã Đại Thắng, Huyện Phú Xuyên, Hà Nội",,123.6,30.74,,,Đã có sổ,Đất thổ cư,,
,2.35,"Đường Yên Hòa, Phường Yên Nghĩa, Quận Hà Đông, Hà Nội",,42.2,55.69,,,Đã có sổ,Đất thổ cư,,
,7.2,"Phố Tôn Đức Thắng, Phường Hàng Bột, Quận Đống Đa, Hà Nội",,35.0,205.71,,,Đã có sổ,Đất thổ cư,,
,3.19,"Đường Liên Xã Hồng Minh - Tri Trung, Xã Tri Trung, Huyện Phú Xuyên, Hà Nội",,110.0,29.0,,,Đã có sổ,Đất nền dự án,,
,2.568,"Đường 429, Xã Phượng Dực, Huyện Phú Xuyên, Hà Nội",,107.0,24.0,,,Đã có sổ,Đất thổ cư,,
,3.0,"tổ dân phố 2 trung sơn trầm, Phường Trung Sơn Trầm, Thị xã Sơn Tây, Hà Nội",,86.0,34.88,,,Đã có sổ,Đất thổ cư,,
,2.8,"thôn Đông Thượng, Xã Đông Yên, Huyện Quốc Oai, Hà Nội",,194.0,14.43,,,Đã có sổ,Đất thổ cư,,
,16.0,"89/49A,  Đường Tứ Liên, Phường Tứ Liên, Quận Tây Hồ, Hà Nội",,67.0,238.81,,,Đã có sổ,Đất thổ cư,,
,8.019,"15 ngách 28 nhõ 40, Phố Tô Vĩnh Diện, Phường Khương Trung, Quận Thanh Xuân, Hà Nội",,37.3,214.99,,,Đã có sổ,Đất thổ cư,,
,5.22,"  ngõ 28 , Đường Tả Thanh Oai, Xã Tả Thanh Oai, Huyện Thanh Trì, Hà Nội",,58.0,90.0,,,Đã có sổ,Đất thổ cư,,
,7.2,"Phố trạm, Phường Long Biên, Quận Long Biên, Hà Nội",,50.0,144.0,,,Đã có sổ,Đất thổ cư,,
,14.2,"Đường Cổ Linh, Phường Long Biên, Quận Long Biên, Hà Nội",,61.0,232.79,,,Đã có sổ,Đất thổ cư,,
,1.8,"Đường tỉnh 420, Xã Bình Yên, Huyện Thạch Thất, Hà Nội",,60.0,30.0,,,Đã có sổ,Đất thổ cư,,
,4.0,"Văn Quán, Xã Đỗ Động, Huyện Thanh Oai, Hà Nội",,80.0,50.0,,,Đã có sổ,Đất thổ cư,,
,14.0,"Phố Tu Hoàng, Phường Phương Canh, Quận Nam Từ Liêm, Hà Nội",,70.0,200.0,,,Đã có sổ,Đất thổ cư,,
,5.5,"Phố Ba La, Phường Phú Lương, Quận Hà Đông, Hà Nội",,50.0,110.0,,,Đang chờ sổ,Đất nền dự án,,
,33.6,"cạnh nhà 639 Lạc Long Quân, lạc long quân, Phường Thụy Khuê, Quận Tây Hồ, Hà Nội",,56.0,600.0,,,Đã có sổ,Đất thổ cư,,
,3.3,"tỉnh lộ 413, Xã Xuân Sơn, Thị xã Sơn Tây, Hà Nội",,385.0,8.57,,,Đã có sổ,Đất thổ cư,,
,9.0,"99, Định côn, Phường Định Công, Quận Hoàng Mai, Hà Nội",,50.0,180.0,,,Đã có sổ,Đất thổ cư,,
,7.5,"43 , Đường Đào Cam Mộc, Xã Uy Nỗ, Huyện Đông Anh, Hà Nội",,50.3,149.11,,,Đã có sổ,Đất thổ cư,,
,15.0,"Đường Đa Sỹ, Phường Kiến Hưng, Quận Hà Đông, Hà Nội",,72.0,208.33,,,Đã có sổ,Đất thổ cư,,
,1.95,"Đông hạ, Xã Đông Yên, Huyện Quốc Oai, Hà Nội",,117.0,16.67,,,Đã có sổ,Đất thổ cư,,
,8.6,"Phố Khâm Thiên, Phường Thổ Quan, Quận Đống Đa, Hà Nội",,52.0,165.38,,,Đã có sổ,Đất thổ cư,,
,8.9,"Đại Từ, Phường Đại Kim, Quận Hoàng Mai, Hà Nội",,66.0,134.85,,,Đã có sổ,Đất thổ cư,,
,2.35,"41, Nam hồng, Xã Nam Hồng, Huyện Đông Anh, Hà Nội",,40.0,58.75,,,Đã có sổ,Đất thổ cư,,
,2.75,"Xóm Cầu , Tổ 12 Đồng Mai, Phường Đồng Mai, Quận Hà Đông, Hà Nội",,44.8,61.38,,,Đã có sổ,Đất thổ cư,,
,7.55,"Vĩnh Ninh, Xã Vĩnh Quỳnh, Huyện Thanh Trì, Hà Nội",,78.0,96.79,,,Đã có sổ,Đất thổ cư,,
,12.0,"Phố Lê Trọng Tấn, Phường Khương Mai, Quận Thanh Xuân, Hà Nội",,59.5,201.68,,,Đã có sổ,Đất thổ cư,,
,8.32,"Quốc Lô 23B, Xã Vân Nội, Huyện Đông Anh, Hà Nội",,128.0,65.0,,,Đã có sổ,Đất thổ cư,,
,8.036,"Ngõ 43 Đường Vân Nội , Xã Vân Nội, Huyện Đông Anh, Hà Nội",,98.0,82.0,,,Đã có sổ,Đất thổ cư,,
,4.66,"Đường tỉnh 420, Xã Bình Yên, Huyện Thạch Thất, Hà Nội",,92.0,50.65,,,Đã có sổ,Đất thổ cư,,
,6.0,"Ngách 2/25 Phố Hoàng Liệt, Phường Hoàng Liệt, Quận Hoàng Mai, Hà Nội",,50.0,120.0,,,Đã có sổ,Đất thổ cư,,
,10.456,"57 ngõ 24, Phố Ngọc Lâm, Phường Long Biên, Quận Long Biên, Hà Nội",,130.0,80.43,,,Đã có sổ,Đất thổ cư,,
,4.114,"Xóm dải, Xã Kim Hoa, Huyện Mê Linh, Hà Nội",,121.0,34.0,,,Đã có sổ,Đất thổ cư,,
,8.99,"Đường Hoàng Tùng, Phường Dương Nội, Quận Hà Đông, Hà Nội",,77.49,116.02,,,Đã có sổ,Đất thổ cư,,
,10.0,"Phố Sa Đôi, Phường Đại Mỗ, Quận Nam Từ Liêm, Hà Nội",,97.0,103.09,,,Đã có sổ,Đất thổ cư,,
,5.2,"Thôn Đoài, Xã Nam Hồng, Huyện Đông Anh, Hà Nội",,85.5,60.82,,,Đã có sổ,Đất thổ cư,,
,1.75,"Đường liên xã, Xã Tân Phú, Huyện Quốc Oai, Hà Nội",,39.0,44.87,,,Đã có sổ,Đất thổ cư,,
,1.7,"Đường Ql32, Xã Đại Đồng, Huyện Thạch Thất, Hà Nội",,88.8,19.14,,,Đã có sổ,Đất thổ cư,,
,8.8,"ngô miễn, Xã Kim Hoa, Huyện Mê Linh, Hà Nội",,200.0,44.0,,,Đã có sổ,Đất thổ cư,,
,3.5,"Bắc Hồng, Xã Bắc Hồng, Huyện Đông Anh, Hà Nội",,53.0,66.04,,,Đã có sổ,Đất thổ cư,,
,2.6,"Mảnh số 11, dãy 1, Giáp đường 84, Khu Đồng Lác, Xã Thạch Hoà, Huyện Thạch Thất, Hà Nội",,125.0,20.8,,,Đang chờ sổ,Đất nền dự án,,
,2.0,"Hạ Bằng, Xã Hạ Bằng, Huyện Thạch Thất, Hà Nội",,82.6,24.21,,,Đã có sổ,Đất thổ cư,,
du_an,price_VND,location,status,area,price_m2,toilet,room,doc,type,Số tầng,furnishing
,5.6,"Số 5 ngõ 189, Đường Ngô Gia Tự, Phường Đức Giang, Quận Long Biên, Hà Nội",,31.5,177.78,,,Đã có sổ,Đất thổ cư,,
,2.6,"Thôn 5 Tân Xã, Xã Tân Xã, Huyện Thạch Thất, Hà Nội",,60.0,43.33,,,Đã có sổ,Đất thổ cư,,
,5.4,"Bạch Thạch, Xã Hòa Thạch, Huyện Quốc Oai, Hà Nội",,4500.0,1.2,,,Sổ chung / công chứng vi bằng,Đất nông nghiệp,,
,4.1,"Viện Quy Hoạch Rừng, Xã Ngọc Hồi, Huyện Thanh Trì, Hà Nội",,55.0,74.55,,,Đã có sổ,Đất thổ cư,,
,0.039,"Chương dương, Xã Chương Dương, Huyện Thường Tín, Hà Nội",,50.4,0.773809,,,Đã có sổ,Đất thổ cư,,
,6.2,"Thôn Mỹ, Xã Cự Khê, Huyện Thanh Oai, Hà Nội",,70.84,87.52,,,Đã có sổ,Đất thổ cư,,
,8.95,"Phố Sa Đôi, Phường Đại Mỗ, Quận Nam Từ Liêm, Hà Nội",,62.0,144.35,,,Đã có sổ,Đất thổ cư,,
,0.0014,"181, Xã Lệ Chi, Huyện Gia Lâm, Hà Nội",,687.0,0.0020369999999999997,,,Đã có sổ,Đất nông nghiệp,,
,3.5,"Đường Kiêu Kỵ, Xã Kiêu Kỵ, Huyện Gia Lâm, Hà Nội",,40.0,87.5,,,Đã có sổ,Đất thổ cư,,
,1.25,"Abc, Xã Chương Dương, Huyện Thường Tín, Hà Nội",,50.0,25.0,,,Đã có sổ,Đất thổ cư,,
,0.0035,"Độ Chàng, Xã Đại Thành, Huyện Quốc Oai, Hà Nội",,648.0,0.0054009999999999996,,,Đã có sổ,Đất nông nghiệp,,
,7.9,"Số 12, tổ 8, Yên Nghĩa, Hà Đông, Hà Nội., Phường Yên Nghĩa, Quận Hà Đông, Hà Nội",,75.0,105.33,,,Đã có sổ,Đất thổ cư,,
,18.5,"Khu 918, Phường Phúc Đồng, Quận Long Biên, Hà Nội",,85.0,217.65,,,Đã có sổ,Đất thổ cư,,
,9.0,"Ngõ 120 Kim Giang, Phường Đại Kim, Quận Hoàng Mai, Hà Nội",,42.0,214.29,,,Đã có sổ,Đất thổ cư,,
,4.4,"Thái Bình, Xã Mai Lâm, Huyện Đông Anh, Hà Nội",,309.0,14.24,,,Đã có sổ,Đất thổ cư,,
,6.2,"Xóm Đầm, Xã Vân Nội, Huyện Đông Anh, Hà Nội",,102.9,60.25,,,Đã có sổ,Đất thổ cư,,
,3.65,"Gần chợ Lắp ghép , Tổ 25, Thị trấn Đông Anh, Huyện Đông Anh, Hà Nội",,46.5,78.49,,,Đã có sổ,Đất thổ cư,,
,5.3,"Phố Nghĩa Dũng, Phường Phúc Xá, Quận Ba Đình, Hà Nội",,46.1,114.97,,,Đã có sổ,Đất thổ cư,,
,4.963,"Sen trì, Xã Bình Yên, Huyện Thạch Thất, Hà Nội",,141.8,35.0,,,Đã có sổ,Đất thổ cư,,
,8.4,"Đê Bối Thạch Đà, Xã Thạch Đà, Huyện Mê Linh, Hà Nội",,400.0,21.0,,,Đã có sổ,Đất thổ cư,,
,0.899,"Hợp Tiến, Xã Hợp Tiến, Huyện Mỹ Đức, Hà Nội",,62.0,14.5,,,Đã có sổ,Đất thổ cư,,
,6.1,"Cự Khối , Phường Cự Khối, Quận Long Biên, Hà Nội",,80.0,76.25,,,Đã có sổ,Đất thổ cư,,
,5.1,"Khu dv 3, Lk7-  31, Đường Quang Trung, Phường Đồng Mai, Quận Hà Đông, Hà Nội",,50.0,102.0,,,Đã có sổ,Đất nền dự án,,
,4.0,"Thôn 1, Xã Duyên Hà, Huyện Thanh Trì, Hà Nội",,44.1,90.7,,,Đã có sổ,Đất thổ cư,,
,2.5," Siêu Quần, Xã Tả Thanh Oai, Huyện Thanh Trì, Hà Nội",,80.0,31.25,,,Giấy tờ viết tay,Đất nông nghiệp,,
,5.0,"Đường Phùng Khoang, Phường Trung Văn, Quận Nam Từ Liêm, Hà Nội",,37.0,135.14,,,Đã có sổ,Đất thổ cư,,
,5.2,"Đại Đồng, Phường Vĩnh Hưng, Quận Hoàng Mai, Hà Nội",,35.0,148.57,,,Đã có sổ,Đất thổ cư,,
,1.95,"Xuân Khanh, Xã Xuân Sơn, Thị xã Sơn Tây, Hà Nội",,230.3,8.47,,,Đã có sổ,Đất thổ cư,,
,0.854,"Thpt Mỹ Đứcb, Xã An Mỹ, Huyện Mỹ Đức, Hà Nội",,50.2,17.01,,,Đã có sổ,Đất thổ cư,,
,3.8,"Liên Thôn , Xã Nam Phương Tiến, Huyện Chương Mỹ, Hà Nội",,1280.0,2.97,,,Đã có sổ,Đất thổ cư,,
,0.63," Ngõ 1111 Đường Tỉnh 72, Xã An Khánh, Huyện Hoài Đức, Hà Nội",,55.0,11.45,,,Sổ chung / công chứng vi bằng,Đất nông nghiệp,,
,1.8,"35, Xã Bắc Phú, Huyện Sóc Sơn, Hà Nội",,157.0,11.46,,,Đã có sổ,Đất thổ cư,,
,0.99,"Vài Mới, Xã Hợp Thanh, Huyện Mỹ Đức, Hà Nội",,97.5,10.15,,,Đã có sổ,Đất thổ cư,,
,0.63,"Đường Liên Mạc, Phường Liên Mạc, Quận Bắc Từ Liêm, Hà Nội",,430.0,0.0014650000000000002,,,Đã có sổ,Đất nông nghiệp,,
,4.5,"Phố Gia Quất, Phường Thượng Thanh, Quận Long Biên, Hà Nội",,50.0,90.0,,,Đã có sổ,Đất thổ cư,,
,4.25,"Phố Đông Thiên, Phường Vĩnh Hưng, Quận Hoàng Mai, Hà Nội",,30.0,141.67,,,Đã có sổ,Đất thổ cư,,
Komi Luxury Hòa Lạc,3.0,"Phú Mãn, Xã Phú Mãn, Huyện Quốc Oai, Hà Nội",,132.0,22.73,,,Đã có sổ,Đất thổ cư,,
,25.5,"40 phố núi trúc, Phố Núi Trúc, Phường Kim Mã, Quận Ba Đình, Hà Nội",,105.0,242.86,,,Đã có sổ,Đất thổ cư,,
,7.8,"thôn 7, Xã Phú Cát, Huyện Quốc Oai, Hà Nội",,390.0,20.0,,,Đã có sổ,Đất thổ cư,,
,5.9,"Kho lương thực, 35b, Xã Thanh Lâm, Huyện Mê Linh, Hà Nội",,185.0,31.89,,,Đã có sổ,Đất thổ cư,,
,35.5,"Đường Lạc Long Quân, Phường Nhật Tân, Quận Tây Hồ, Hà Nội",,135.0,262.96,,,Đã có sổ,Đất thổ cư,,
,1.9,"Vĩnh Lộc, Xã Thư Phú, Huyện Thường Tín, Hà Nội",,41.0,46.34,,,Đã có sổ,Đất thổ cư,,
,4.85,"Phố Hoa Bằng, Phường Yên Hoà, Quận Cầu Giấy, Hà Nội",,81.0,59.88,,,Đang chờ sổ,Đất thổ cư,,
,1.36,"2, Đường Lập Trí, Xã Minh Trí, Huyện Sóc Sơn, Hà Nội",,90.4,15.04,,,Đã có sổ,Đất thổ cư,,
,2.6,"Phố Mã, Xã Phù Linh, Huyện Sóc Sơn, Hà Nội",,117.0,22.22,,,Đã có sổ,Đất thổ cư,,
,4.8,"Đường Trâu Quỳ, Thị trấn Trâu Quỳ, Huyện Gia Lâm, Hà Nội",,60.0,80.0,,,Đã có sổ,Đất thổ cư,,
,5.2,"Nhân Lễ, Xã Đặng Xá, Huyện Gia Lâm, Hà Nội",,80.0,65.0,,,Đã có sổ,Đất thổ cư,,
,9.7,"Đường vành đai 3,5, Xã Vân Canh, Huyện Hoài Đức, Hà Nội",,50.0,194.0,,,Đã có sổ,Đất thổ cư,,
,6.5,"Đường Xuân Đỉnh, Phường Xuân Đỉnh, Quận Bắc Từ Liêm, Hà Nội",,56.0,116.07,,,Đã có sổ,Đất thổ cư,,
,9.5,"Đường Cầu Diễn, Phường Minh Khai, Quận Bắc Từ Liêm, Hà Nội",,60.0,158.33,,,Đã có sổ,Đất thổ cư,,
