du_an,price_VND,location,status,area,price_m2,toilet,room,doc,type,Số tầng,furnishing
,1.05,"Tân Hội, Xã Tân Tiến, Huyện Chương Mỹ, Hà Nội",,82.8,12.68,,,Đã có sổ,Đất thổ cư,,
,4.5,"QL21, Xã Phú Cát, Huyện Quốc Oai, Hà Nội",,87.0,51.72,,,Đã có sổ,Đất thổ cư,,
,6.0,"Phố Nguyễn An Ninh, Phường Tương Mai, Quận Hoàng Mai, Hà Nội",,59.0,101.69,,,Đã có sổ,Đất thổ cư,,
,21.0,"nam an khánh, Xã An Khánh, Huyện Hoài Đức, Hà Nội",,90.0,233.33,,,Đã có sổ,Đất thổ cư,,
,6.4,"Phố Thượng Thanh, Phường Thượng Thanh, Quận Long Biên, Hà Nội",,50.0,128.0,,,Đã có sổ,Đất thổ cư,,
,4.5,"Thanh am, Phường Thượng Thanh, Quận Long Biên, Hà Nội",,52.0,86.54,,,Đã có sổ,Đất thổ cư,,
,12.0,"Đường 21b, Xã Bích Hòa, Huyện Thanh Oai, Hà Nội",,98.0,122.45,,,Đã có sổ,Đất thổ cư,,
,2.55,"Hòa Sơn, Thị trấn Chúc Sơn, Huyện Chương Mỹ, Hà Nội",,35.9,71.03,,,Đã có sổ,Đất thổ cư,,
,16.38,"Phố Ngọc Lâm, Phường Ngọc Lâm, Quận Long Biên, Hà Nội",,90.0,182.0,,,Đã có sổ,Đất thổ cư,,
,4.08,"Thôn Yên Thái, Xã Đông Yên, Huyện Quốc Oai, Hà Nội",,204.1,19.99,,,Đã có sổ,Đất thổ cư,,
,3.0,"Đường Ngọc Thụy, Phường Ngọc Thụy, Quận Long Biên, Hà Nội",,46.0,65.22,,,Đã có sổ,Đất thổ cư,,
,10.0,"92A, Đồng Đảng, Xã Hiền Ninh, Huyện Sóc Sơn, Hà Nội",,1900.0,5.26,,,Đang chờ sổ,Đất thổ cư,,
,17.53,"Đường Ngọc Thụy, Phường Ngọc Thụy, Quận Long Biên, Hà Nội",,82.0,213.78,,,Đã có sổ,Đất thổ cư,,
,14.2,"Mai Hiên, Xã Mai Lâm, Huyện Đông Anh, Hà Nội",,188.0,75.53,,,Đã có sổ,Đất thổ cư,,
,2.58,"Phúc Thọ, Xã Mai Lâm, Huyện Đông Anh, Hà Nội",,44.0,58.64,,,Đã có sổ,Đất thổ cư,,
,85.0,"Phố Nguyễn Hữu Thọ, Phường Đại Kim, Quận Hoàng Mai, Hà Nội",,232.0,366.38,,,Đã có sổ,Đất thổ cư,,
,0.82,"Thôn Ngọ, Xã Chuyên Mỹ, Huyện Phú Xuyên, Hà Nội",,44.0,18.64,,,Đã có sổ,Đất thổ cư,,
,0.85,"Trạch Mỹ Lộc, Xã Trạch Mỹ Lộc, Huyện Phúc Thọ, Hà Nội",,46.6,18.24,,,Đã có sổ,Đất thổ cư,,
,0.45,"Chưa có, Phú Hiền, Xã Hợp Thanh, Huyện Mỹ Đức, Hà Nội",,50.2,8.96,,,Đã có sổ,Đất thổ cư,,
,15.0,"28, Ngõ 21 Nguyễn Ngọc Nại, Phường Khương Mai, Quận Thanh Xuân, Hà Nội",,72.0,208.33,,,Đã có sổ,Đất thổ cư,,
,12.54,"Đỗ Xá, Xã Vạn Điểm, Huyện Thường Tín, Hà Nội",,456.0,27.5,,,Đã có sổ,Đất thổ cư,,
,6.0,Phố Yên Lộ,,55.0,109.09,,,Đã có sổ,Đất thổ cư,,
,6.1,"Đường Quang Tiến, Phường Đại Mỗ, Quận Nam Từ Liêm, Hà Nội",,50.0,122.0,,,Đã có sổ,Đất thổ cư,,
,3.55,"Quán Chảy, Xã Đông La, Huyện Hoài Đức, Hà Nội",,45.0,78.89,,,Đã có sổ,Đất thổ cư,,
,1.6,"Muồng Cháu, Xã Vân Hòa, Huyện Ba Vì, Hà Nội",,440.0,3.64,,,Đã có sổ,Đất thổ cư,,
,3.0,"Xóm 4 Hải Bối, Xã Hải Bối, Huyện Đông Anh, Hà Nội",,47.0,63.83,,,Đã có sổ,Đất thổ cư,,
,2.6,"giao tất, Xã Kim Sơn, Huyện Gia Lâm, Hà Nội",,57.0,45.61,,,Đã có sổ,Đất thổ cư,,
,6.75,"Đường Lê Đức Thọ, Phường Mỹ Đình 2, Quận Nam Từ Liêm, Hà Nội",,35.0,192.86,,,Đã có sổ,Đất thổ cư,,
,2.6,"Cánh Chủ, Xã Bình Yên, Huyện Thạch Thất, Hà Nội",,193.0,13.47,,,Đã có sổ,Đất thổ cư,,
,4.2,"Đại Thành, Xã Đại Thành, Huyện Quốc Oai, Hà Nội",,90.0,46.67,,,Đã có sổ,Đất thổ cư,,
,7.844,"Bãi Dài, Xã Tiến Xuân, Huyện Thạch Thất, Hà Nội",,296.0,26.5,,,Đã có sổ,Đất thổ cư,,
,1.99,"Làng trên, Xã Phú Mãn, Huyện Quốc Oai, Hà Nội",,150.0,13.27,,,Đã có sổ,Đất thổ cư,,
,11.6,"Phố Kim Ngưu, Phường Thanh Nhàn, Quận Hai Bà Trưng, Hà Nội",,118.0,98.31,,,Đã có sổ,Đất thổ cư,,
,2.6,"Thắng Lợi , Xã Phú Minh, Huyện Sóc Sơn, Hà Nội",,111.0,23.42,,,Đã có sổ,Đất thổ cư,,
,14.3,"Phố Nguyễn Thời Trung, Phường Thạch Bàn, Quận Long Biên, Hà Nội",,82.0,174.39,,,Đã có sổ,Đất nền dự án,,
,7.6,"Đường tỉnh 420, Xã Bình Yên, Huyện Thạch Thất, Hà Nội",,401.0,18.95,,,Đã có sổ,Đất thổ cư,,
,12.25,"26, Phố Hoàng Trọng Mậu, Phường Mỹ Đình 1, Quận Nam Từ Liêm, Hà Nội",,46.3,264.58,,,Đã có sổ,Đất thổ cư,,
,6.0,"Đường Tây Mỗ, Phường Tây Mỗ, Quận Nam Từ Liêm, Hà Nội",,45.0,133.33,,,Đã có sổ,Đất thổ cư,,
,17.9,"Phố Nông Vụ, Phường Phúc Lợi, Quận Long Biên, Hà Nội",,88.0,203.41,,,Đã có sổ,Đất nền dự án,,
,5.1,"DG7-06, Khu Đấu Giá Khánh Tân, Xã Sài Sơn, Huyện Quốc Oai, Hà Nội",,100.0,51.0,,,Đã có sổ,Đất thổ cư,,
,1.78,"Liên Thôn , Xã Thư Phú, Huyện Thường Tín, Hà Nội",,55.0,32.36,,,Đã có sổ,Đất thổ cư,,
,8.7,"Khu 918 , Phường Phúc Đồng, Quận Long Biên, Hà Nội",,38.0,228.95,,,Đã có sổ,Đất thổ cư,,
,3.65,"thanh am, Phường Thượng Thanh, Quận Long Biên, Hà Nội",,30.0,121.67,,,Đã có sổ,Đất thổ cư,,
,3.6,"Đại Lộ Thăng Long, Xã Yên Sơn, Huyện Quốc Oai, Hà Nội",,80.0,45.0,,,Đã có sổ,Đất thổ cư,,
,3.5,"Thuỷ Xuân Tiên, Xã Thủy Xuân Tiên, Huyện Chương Mỹ, Hà Nội",,265.0,13.21,,,Đã có sổ,Đất thổ cư,,
,3.5,"TL 412B, Xã Đông Yên, Huyện Quốc Oai, Hà Nội",,227.0,15.42,,,Đã có sổ,Đất thổ cư,,
,5.75,"Đường Ngọc Thụy, Phường Ngọc Thụy, Quận Long Biên, Hà Nội",,60.0,95.83,,,Đã có sổ,Đất thổ cư,,
,6.0,"Thôn Muồng Phú Vàng, Xã Vân Hòa, Huyện Ba Vì, Hà Nội",,856.0,7.01,,,Đã có sổ,Đất thổ cư,,
,3.08,"đường trục kinh tế phía bắc, Xã Cao Thành, Huyện Ứng Hòa, Hà Nội",,114.0,27.02,,,Đã có sổ,Đất thổ cư,,
,3.75,"quốc lộ 5, Xã Xuân Canh, Huyện Đông Anh, Hà Nội",,42.0,89.29,,,Đã có sổ,Đất thổ cư,,
,1.89,"kênh, Xã Minh Trí, Huyện Sóc Sơn, Hà Nội",,90.0,21.0,,,Đã có sổ,Đất thổ cư,,
,2.3,"2, Đường Quốc lộ 6 mở rộng (Ba La - Xuân Mai), Phường Biên Giang, Quận Hà Đông, Hà Nội",,46.6,49.36,,,Đã có sổ,Đất thổ cư,,
,1.97,"Vụ Bản, Xã Minh Trí, Huyện Sóc Sơn, Hà Nội",,85.0,23.18,,,Đã có sổ,Đất thổ cư,,
,1.36,"Liên Thôn , Xã Chương Dương, Huyện Thường Tín, Hà Nội",,48.0,28.33,,,Đã có sổ,Đất thổ cư,,
,1.86,"Thuỵ Hà, Xã Bắc Hồng, Huyện Đông Anh, Hà Nội",,42.0,44.29,,,Đã có sổ,Đất thổ cư,,
,4.2,"Đường Ngọc Thụy, Phường Ngọc Thụy, Quận Long Biên, Hà Nội",,45.0,93.33,,,Đã có sổ,Đất thổ cư,,
,6.3,"Nguyễn Đức Cảnh, Phường Tân Mai, Quận Hoàng Mai, Hà Nội",,61.0,103.28,,,Đã có sổ,Đất thổ cư,,
,4.5,"Phố Hà Trì, Phường Hà Cầu, Quận Hà Đông, Hà Nội",,45.0,100.0,,,Đã có sổ,Đất thổ cư,,
,2.73,"Cầu Thăng Long, Xã Hải Bối, Huyện Đông Anh, Hà Nội",,48.0,56.88,,,Đã có sổ,Đất thổ cư,,
,13.8,"Đường Lạc Long Quân, Phường Nhật Tân, Quận Tây Hồ, Hà Nội",,75.0,184.0,,,Đã có sổ,Đất thổ cư,,
du_an,price_VND,location,status,area,price_m2,toilet,room,doc,type,Số tầng,furnishing
,1.9,"Liên xã, Xã Khánh Hà, Huyện Thường Tín, Hà Nội",,45.0,42.22,,,Đã có sổ,Đất thổ cư,,
,4.5,"Tiên Dương, Xã Tiên Dương, Huyện Đông Anh, Hà Nội",,60.0,75.0,,,Đã có sổ,Đất thổ cư,,
,8.0,"Ngõ 104 Nguyễn An NInh, Phường Trương Định, Quận Hai Bà Trưng, Hà Nội",,60.0,133.33,,,Đã có sổ,Đất thổ cư,,
,1.0,"Đường liên thôn , Xã Tân Tiến, Huyện Chương Mỹ, Hà Nội",,80.0,12.5,,,Đã có sổ,Đất thổ cư,,
,9.186,"Đìa Đừng, Thị trấn Phùng, Huyện Đan Phượng, Hà Nội",,84.28,108.99,,,Đã có sổ,Đất thổ cư,,
,9.0,"Nội Bộ, Phường Yên Nghĩa, Quận Hà Đông, Hà Nội",,50.0,180.0,,,Đã có sổ,Đất nền dự án,,
,13.6,"3,5, Xã Di Trạch, Huyện Hoài Đức, Hà Nội",,95.0,143.16,,,Đã có sổ,Đất thổ cư,,
,2.1,"Phú Bến, Xã Thụy Hương, Huyện Chương Mỹ, Hà Nội",,50.0,42.0,,,Đã có sổ,Đất thổ cư,,
,3.95,"Phố Tình Quang, Phường Giang Biên, Quận Long Biên, Hà Nội",,50.0,79.0,,,Đã có sổ,Đất thổ cư,,
,3.65,"Khoan Tế, Xã Đa Tốn, Huyện Gia Lâm, Hà Nội",,52.8,69.13,,,Đã có sổ,Đất thổ cư,,
,16.4,"Trâu Quỳ, Thị trấn Trâu Quỳ, Huyện Gia Lâm, Hà Nội",,119.0,137.82,,,Đã có sổ,Đất thổ cư,,
,5.45,"Quốc Lộ 3, Xã Tiên Dương, Huyện Đông Anh, Hà Nội",,71.0,76.76,,,Đã có sổ,Đất thổ cư,,
,7.3,"Phố Phúc Xá, Phường Phúc Xá, Quận Ba Đình, Hà Nội",,74.0,98.65,,,Đã có sổ,Đất thổ cư,,
,3.3,"Tổ 13, Thị trấn Đông Anh, Huyện Đông Anh, Hà Nội",,55.0,60.0,,,Đã có sổ,Đất thổ cư,,
,1.575,"Xuân Bách, Xã Quang Tiến, Huyện Sóc Sơn, Hà Nội",,70.0,22.5,,,Đã có sổ,Đất thổ cư,,
,6.9,"Phố Nghĩa Dũng, Phường Phúc Xá, Quận Ba Đình, Hà Nội",,90.0,76.67,,,Đã có sổ,Đất thổ cư,,
,5.85,"Phố Thanh Lân, Phường Thanh Trì, Quận Hoàng Mai, Hà Nội",,73.0,80.14,,,Đã có sổ,Đất thổ cư,,
,3.1,"Phố Châu Đài, Phường Thượng Cát, Quận Bắc Từ Liêm, Hà Nội",,38.0,81.58,,,Đã có sổ,Đất thổ cư,,
,2.1,"Liên xã, Xã Đại áng, Huyện Thanh Trì, Hà Nội",,49.0,42.86,,,Đã có sổ,Đất thổ cư,,
,7.0,"Phố Yên Sở, Phường Yên Sở, Quận Hoàng Mai, Hà Nội",,65.0,107.69,,,Đã có sổ,Đất thổ cư,,
,17.5,"Đường An Dương Vương, Phường Phú Thượng, Quận Tây Hồ, Hà Nội",,140.0,125.0,,,Đã có sổ,Đất thổ cư,,
,5.15,"Đường Bát Khối, Phường Cự Khối, Quận Long Biên, Hà Nội",,54.0,95.37,,,Đã có sổ,Đất thổ cư,,
,5.068,"Ngõ 6, Thanh Sơn 14, Xã Minh Phú, Huyện Sóc Sơn, Hà Nội",,248.0,20.44,,,Đã có sổ,Đất thổ cư,,
,7.85,"Đường 19 Tháng 5, Phường Văn Quán, Quận Hà Đông, Hà Nội",,55.0,142.73,,,Đã có sổ,Đất thổ cư,,
,1.95,"Đường tỉnh 131, Xã Quang Tiến, Huyện Sóc Sơn, Hà Nội",,52.0,37.5,,,Đã có sổ,Đất thổ cư,,
,4.89,"Đường Hà Huy Tập, Thị trấn Yên Viên, Huyện Gia Lâm, Hà Nội",,47.0,104.04,,,Đã có sổ,Đất thổ cư,,
,1.82,"Dt420, Xã Bình Yên, Huyện Thạch Thất, Hà Nội",,75.0,24.27,,,Đã có sổ,Đất thổ cư,,
,8.2,"Kim Giang, Xã Thanh Liệt, Huyện Thanh Trì, Hà Nội",,60.0,136.67,,,Đã có sổ,Đất thổ cư,,
,9.0,"Phố Nhổn, Phường Tây Tựu, Quận Bắc Từ Liêm, Hà Nội",,92.0,97.83,,,Đã có sổ,Đất thổ cư,,
,2.85,"đông la, Xã Đông La, Huyện Hoài Đức, Hà Nội",,48.4,58.88,,,Đã có sổ,Đất thổ cư,,
,17.5,"Phố Dương Khuê, Phường Mai Dịch, Quận Cầu Giấy, Hà Nội",,40.0,437.5,,,Đã có sổ,Đất thổ cư,,
,7.2,"Phố Nguyễn Văn Trỗi, Phường Mộ Lao, Quận Hà Đông, Hà Nội",,52.0,138.46,,,Đã có sổ,Đất thổ cư,,
,18.0,"Đường Đại Mỗ, Phường Đại Mỗ, Quận Nam Từ Liêm, Hà Nội",,75.0,240.0,,,Đã có sổ,Đất thổ cư,,
,5.55,"Ngõ 367 phố Ngô Xuân Quảng, Thị trấn Trâu Quỳ, Huyện Gia Lâm, Hà Nội",,46.3,119.87,,,Đã có sổ,Đất thổ cư,,
,9.0,"Đường 23B, Xã Thanh Lâm, Huyện Mê Linh, Hà Nội",,400.0,22.5,,,Đã có sổ,Đất thổ cư,,
,2.9,"Đông Ngàn, Xã Đông Hội, Huyện Đông Anh, Hà Nội",,54.0,53.7,,,Đã có sổ,Đất thổ cư,,
,6.37,"Liên xã, Xã Khánh Hà, Huyện Thường Tín, Hà Nội",,106.0,60.09,,,Đã có sổ,Đất thổ cư,,
,6.39,"Liên xã, Xã Khánh Hà, Huyện Thường Tín, Hà Nội",,107.0,59.72,,,Đã có sổ,Đất thổ cư,,
,1.05,"Đường Đường tỉnh 35, Xã Tân Dân, Huyện Sóc Sơn, Hà Nội",,50.0,21.0,,,Đã có sổ,Đất thổ cư,,
,4.7,"Phố Ngọc Lâm, Phường Ngọc Lâm, Quận Long Biên, Hà Nội",,42.0,111.9,,,Đã có sổ,Đất thổ cư,,
,6.39,"Liên xã, Xã Khánh Hà, Huyện Thường Tín, Hà Nội",,107.0,59.72,,,Đã có sổ,Đất thổ cư,,
,1.05,"Đường Đường tỉnh 35, Xã Tân Dân, Huyện Sóc Sơn, Hà Nội",,50.0,21.0,,,Đã có sổ,Đất thổ cư,,
,4.7,"Phố Ngọc Lâm, Phường Ngọc Lâm, Quận Long Biên, Hà Nội",,42.0,111.9,,,Đã có sổ,Đất thổ cư,,
,2.2,"Đình Trung, Xã Xuân Nộn, Huyện Đông Anh, Hà Nội",,59.0,37.29,,,Đã có sổ,Đất thổ cư,,
,36.0,"Phố Kim Quan Thượng, Phường Việt Hưng, Quận Long Biên, Hà Nội",,330.0,109.09,,,Đã có sổ,Đất thổ cư,,
,2.3,"420, Xã Bình Yên, Huyện Thạch Thất, Hà Nội",,120.0,19.17,,,Đã có sổ,Đất thổ cư,,
,1.98,"đại lộ thăng long, Xã Phú Cát, Huyện Quốc Oai, Hà Nội",,64.0,30.94,,,Đã có sổ,Đất thổ cư,,
,4.4,"Đường Gia Thượng, Phường Thượng Thanh, Quận Long Biên, Hà Nội",,60.7,72.49,,,Đã có sổ,Đất thổ cư,,
,6.9,"Thạch Cầu, Phường Long Biên, Quận Long Biên, Hà Nội",,104.0,66.35,,,Đã có sổ,Đất thổ cư,,
,0.17,"Đường tỉnh 420, Xã Bình Yên, Huyện Thạch Thất, Hà Nội",,112.0,1.52,,,Đã có sổ,Đất thổ cư,,
,12.5,"Đường Cổ Linh, Phường Long Biên, Quận Long Biên, Hà Nội",,62.0,201.61,,,Đã có sổ,Đất thổ cư,,
,3.0,"Đường Ngọc Thụy, Phường Ngọc Thụy, Quận Long Biên, Hà Nội",,46.0,65.22,,,Đã có sổ,Đất thổ cư,,
,3.5,"liên xã, Xã Nam Phương Tiến, Huyện Chương Mỹ, Hà Nội",,1050.0,3.33,,,Đã có sổ,Đất thổ cư,,
,24.8,"Đường La Thành, Phường Ô Chợ Dừa, Quận Đống Đa, Hà Nội",,83.0,298.8,,,Đã có sổ,Đất thổ cư,,
,1.7,"liên xã, Xã Nam Phương Tiến, Huyện Chương Mỹ, Hà Nội",,238.0,7.14,,,Đã có sổ,Đất thổ cư,,
,1.95,"Phú Cát, Xã Phú Cát, Huyện Quốc Oai, Hà Nội",,64.0,30.47,,,Đã có sổ,Đất thổ cư,,
,23.0,"Phố Định Công Thượng, Phường Định Công, Quận Hoàng Mai, Hà Nội",,100.0,230.0,,,Đã có sổ,Đất thổ cư,,
,4.18,"Đường Gia Thượng, Phường Thượng Thanh, Quận Long Biên, Hà Nội",,49.2,84.96,,,Đã có sổ,Đất thổ cư,,
,64.0,"Phố Quảng Khánh, Phường Quảng An, Quận Tây Hồ, Hà Nội",,100.0,640.0,,,Đã có sổ,Đất thổ cư,,
,5.8,"Đường 25M Cự Khối, Phường Cự Khối, Quận Long Biên, Hà Nội",,38.0,152.63,,,Đã có sổ,Đất thổ cư,,
du_an,price_VND,location,status,area,price_m2,toilet,room,doc,type,Số tầng,furnishing
,2.3,"Đất Đấu Giá, Xã Chuyên Mỹ, Huyện Phú Xuyên, Hà Nội",,100.0,23.0,,,Đã có sổ,Đất thổ cư,,
,10.8,"Phố Ỷ La, Phường Dương Nội, Quận Hà Đông, Hà Nội",,106.0,101.89,,,Đã có sổ,Đất thổ cư,,
,1.25,"Tam Đạc 2, Xã Thọ An, Huyện Đan Phượng, Hà Nội",,46.0,27.17,,,Đã có sổ,Đất thổ cư,,
,3.4,"Chùa thầy, Xã Sài Sơn, Huyện Quốc Oai, Hà Nội",,80.0,42.5,,,Đã có sổ,Đất thổ cư,,
,11.0,"Hải Bối, Xã Hải Bối, Huyện Đông Anh, Hà Nội",,80.0,137.5,,,Đã có sổ,Đất nền dự án,,
,1.1,"Xóm 4, Xã Tự Nhiên, Huyện Thường Tín, Hà Nội",,41.0,26.83,,,Đã có sổ,Đất thổ cư,,
,2.1,"Mỹ Lâm, Thị trấn Phú Xuyên, Huyện Phú Xuyên, Hà Nội",,83.0,25.3,,,Đã có sổ,Đất thổ cư,,
,2.9,"Đường Xuân Khôi, Phường Cự Khối, Quận Long Biên, Hà Nội",,60.0,48.33,,,Đã có sổ,Đất thổ cư,,
,4.8,"Đản Dị, Xã Uy Nỗ, Huyện Đông Anh, Hà Nội",,55.0,87.27,,,Đã có sổ,Đất thổ cư,,
,4.1,"Lâm Tiên, Thị trấn Đông Anh, Huyện Đông Anh, Hà Nội",,80.0,51.25,,,Đã có sổ,Đất thổ cư,,
,4.5,"Hiền Ninh, Xã Hiền Ninh, Huyện Sóc Sơn, Hà Nội",,120.0,37.5,,,Đã có sổ,Đất thổ cư,,
,2.45,"08, VĂN KHÊ,TAM HƯNG, Xã Bích Hòa, Huyện Thanh Oai, Hà Nội",,45.0,54.44,,,Đã có sổ,Đất thổ cư,,
,2.5,"Đường huyện 10, Xã Tân Xã, Huyện Thạch Thất, Hà Nội",,60.0,41.67,,,Đã có sổ,Đất thổ cư,,
,1.25,"3, Chương Lộc, Xã Chương Dương, Huyện Thường Tín, Hà Nội",,44.0,28.41,,,Đã có sổ,Đất thổ cư,,
,6.85,"Phố Tình Quang, Phường Giang Biên, Quận Long Biên, Hà Nội",,92.0,74.46,,,Đã có sổ,Đất thổ cư,,
,7.3,Nguyễn Văn Cừ,,55.0,132.73,,,Đã có sổ,Đất thổ cư,,
,12.0,"Đường Nguyễn Văn Cừ, Phường Ngọc Lâm, Quận Long Biên, Hà Nội",,82.0,146.34,,,Đã có sổ,Đất thổ cư,,
,1.95,"Thanh Trí, Xã Minh Phú, Huyện Sóc Sơn, Hà Nội",,127.0,15.35,,,Đã có sổ,Đất thổ cư,,
,9.0,"Vân Trì, Xã Vân Nội, Huyện Đông Anh, Hà Nội",,129.5,69.5,,,Đã có sổ,Đất thổ cư,,
,2.6,"Hồ Chí Minh, Xã An Phú, Huyện Mỹ Đức, Hà Nội",,460.0,5.65,,,Đã có sổ,Đất thổ cư,,
,9.0,"Vân Trì, Xã Vân Nội, Huyện Đông Anh, Hà Nội",,129.5,69.5,,,Đã có sổ,Đất thổ cư,,
,2.6,"Hồ Chí Minh, Xã An Phú, Huyện Mỹ Đức, Hà Nội",,460.0,5.65,,,Đã có sổ,Đất thổ cư,,
,7.65,"Đường Ỷ Lan, Xã Đặng Xá, Huyện Gia Lâm, Hà Nội",,120.0,63.75,,,Đã có sổ,Đất thổ cư,,
,10.3,"Võ Nguyên Giáp, Xã Vĩnh Ngọc, Huyện Đông Anh, Hà Nội",,73.0,141.1,,,Đã có sổ,Đất thổ cư,,
,6.65,"Đường Võ Nguyên Giáp, Xã Tiên Dương, Huyện Đông Anh, Hà Nội",,82.0,81.1,,,Đã có sổ,Đất thổ cư,,
,3.85,"Đường 100, Thị trấn Quang Minh, Huyện Mê Linh, Hà Nội",,76.0,50.66,,,Đã có sổ,Đất thổ cư,,
,15.5,"Đường Hưng Phúc, Phường Yên Sở, Quận Hoàng Mai, Hà Nội",,80.0,193.75,,,Đã có sổ,Đất thổ cư,,
,2.1,"Đường Hà Huy Tập, Thị trấn Yên Viên, Huyện Gia Lâm, Hà Nội",,50.0,42.0,,,Đã có sổ,Đất thổ cư,,
,10.65,"Đường Ngô Gia Tự, Phường Đức Giang, Quận Long Biên, Hà Nội",,50.0,213.0,,,Đã có sổ,Đất thổ cư,,
,14.0,"Phố Mễ Trì Hạ, Phường Mễ Trì, Quận Nam Từ Liêm, Hà Nội",,55.0,254.55,,,Đã có sổ,Đất thổ cư,,
,2.35,"Bắc Thượng, Xã Quang Tiến, Huyện Sóc Sơn, Hà Nội",,62.6,37.54,,,Đã có sổ,Đất thổ cư,,
,2.15,"Thư Phú, Xã Thư Phú, Huyện Thường Tín, Hà Nội",,52.0,41.35,,,Đã có sổ,Đất thổ cư,,
,2.45,"Vạn Phúc, Xã Vạn Phúc, Huyện Thanh Trì, Hà Nội",,45.0,54.44,,,Đã có sổ,Đất thổ cư,,
,2.6,"Vạn Phúc, Xã Vạn Phúc, Huyện Thanh Trì, Hà Nội",,45.0,57.78,,,Đã có sổ,Đất thổ cư,,
,5.1,"Liên Ninh, Xã Liên Ninh, Huyện Thanh Trì, Hà Nội",,77.0,66.23,,,Đã có sổ,Đất thổ cư,,
,6.5,"Đông mỹ, Xã Đông Mỹ, Huyện Thanh Trì, Hà Nội",,110.0,59.09,,,Đã có sổ,Đất thổ cư,,
,15.5,"vành đai 3.5, Xã Di Trạch, Huyện Hoài Đức, Hà Nội",,112.0,138.39,,,Đã có sổ,Đất thổ cư,,
,10.6,"3.5, Xã Di Trạch, Huyện Hoài Đức, Hà Nội",,90.0,117.78,,,Đã có sổ,Đất thổ cư,,
,11.8,"3,5, Xã Di Trạch, Huyện Hoài Đức, Hà Nội",,80.0,147.5,,,Đã có sổ,Đất thổ cư,,
,16.5,"đường vành đai 3,5, Xã Di Trạch, Huyện Hoài Đức, Hà Nội",,110.0,150.0,,,Đã có sổ,Đất thổ cư,,
,16.8,"3,5, Xã Di Trạch, Huyện Hoài Đức, Hà Nội",,115.0,146.09,,,Đã có sổ,Đất thổ cư,,
,16.5,"3,5, Xã Di Trạch, Huyện Hoài Đức, Hà Nội",,125.0,132.0,,,Đã có sổ,Đất thổ cư,,
,11.9,"32, Thị trấn Phùng, Huyện Đan Phượng, Hà Nội",,89.0,133.71,,,Đã có sổ,Đất thổ cư,,
,5.6,"Dân sinh, Thị trấn Quang Minh, Huyện Mê Linh, Hà Nội",,92.0,60.87,,,Đã có sổ,Đất thổ cư,,
,1.45,"Trục Chính Liên Thôn , Xã Nam Phương Tiến, Huyện Chương Mỹ, Hà Nội",,129.0,11.24,,,Đã có sổ,Đất thổ cư,,
,3.29,"Dân sinh, Thị trấn Quang Minh, Huyện Mê Linh, Hà Nội",,70.0,47.0,,,Đã có sổ,Đất thổ cư,,
,2.66,"Xóm 5 Tráng Việt, Xã Tráng Việt, Huyện Mê Linh, Hà Nội",,86.0,30.93,,,Đã có sổ,Đất thổ cư,,
,12.0,"Hữu Lê, Xã Hữu Hoà, Huyện Thanh Trì, Hà Nội",,52.5,228.57,,,Đã có sổ,Đất thổ cư,,
,1.28,"Chùa Thầy, Xã Sài Sơn, Huyện Quốc Oai, Hà Nội",,400.0,3.2,,,Đã có sổ,Đất nông nghiệp,,
,10.8,"Phố Ỷ La, Phường Dương Nội, Quận Hà Đông, Hà Nội",,106.0,101.89,,,Đã có sổ,Đất thổ cư,,
,1.68,"Đường Liên Thôn Thắng Hữu Minh Trí Sóc Sơn Hà Nội, Xã Minh Trí, Huyện Sóc Sơn, Hà Nội",,100.0,16.8,,,Đã có sổ,Đất thổ cư,,
,15.7,"Phố Kim Quan Thượng, Phường Việt Hưng, Quận Long Biên, Hà Nội",,101.0,155.45,,,Đã có sổ,Đất thổ cư,,
,4.8,"Phố Mai Phúc, Phường Phúc Đồng, Quận Long Biên, Hà Nội",,35.0,137.14,,,Đã có sổ,Đất thổ cư,,
,8.4,"Đường Ngô Gia Tự, Phường Việt Hưng, Quận Long Biên, Hà Nội",,60.0,140.0,,,Đã có sổ,Đất thổ cư,,
,5.9,"Phố Đàm Quang Trung, Phường Long Biên, Quận Long Biên, Hà Nội",,47.0,125.53,,,Đã có sổ,Đất thổ cư,,
,15.6,"Đường Ngọc Thụy, Phường Ngọc Thụy, Quận Long Biên, Hà Nội",,80.0,195.0,,,Đã có sổ,Đất thổ cư,,
,6.0,"Đường Phúc Lợi, Phường Phúc Lợi, Quận Long Biên, Hà Nội",,60.0,100.0,,,Đã có sổ,Đất thổ cư,,
,9.5,"Đường Nguyễn Gia Bồng, Phường Ngọc Thụy, Quận Long Biên, Hà Nội",,83.0,114.46,,,Đã có sổ,Đất thổ cư,,
,14.6,"Phố Trạm, Phường Long Biên, Quận Long Biên, Hà Nội",,100.0,146.0,,,Đã có sổ,Đất thổ cư,,
,10.8,"Đường Cổ Linh, Phường Thạch Bàn, Quận Long Biên, Hà Nội",,62.0,174.19,,,Đã có sổ,Đất thổ cư,,
,3.8,"Đường Gia Lương, Xã Việt Hùng, Huyện Đông Anh, Hà Nội",,52.1,72.94,,,Đã có sổ,Đất thổ cư,,
,12.3,"Phố Nguyễn Thời Trung, Phường Thạch Bàn, Quận Long Biên, Hà Nội",,58.0,212.07,,,Đã có sổ,Đất thổ cư,,
,2.42,"Kỳ Dương, Xã Chương Dương, Huyện Thường Tín, Hà Nội",,93.0,26.02,,,Đã có sổ,Đất thổ cư,,
,1.1,"Xóm 4, Xã Tự Nhiên, Huyện Thường Tín, Hà Nội",,41.0,26.83,,,Đã có sổ,Đất thổ cư,,
,9.35,"C6, Nguyễn Trực, QL21B, Hà Đông, Hà Nội., Phường Phú Lương, Quận Hà Đông, Hà Nội",,56.0,166.96,,,Đã có sổ,Đất thổ cư,,
,4.0,"Phố Trần Điền, Phường Định Công, Quận Hoàng Mai, Hà Nội",,100.0,40.0,,,Giấy tờ viết tay,Đất thổ cư,,
,4.24,"Ngách 3 Ngõ 45 An Trai, Xã Vân Canh, Huyện Hoài Đức, Hà Nội",,45.0,94.22,,,Đã có sổ,Đất thổ cư,,
,1.555,"Viêm Khê, Xã Hợp Thanh, Huyện Mỹ Đức, Hà Nội",,146.0,10.65,,,Đã có sổ,Đất thổ cư,,
,11.484,"Đường Thạch Bàn, Phường Thạch Bàn, Quận Long Biên, Hà Nội",,66.0,174.0,,,Đã có sổ,Đất thổ cư,,
,10.5,"Đường Đại Mỗ, Phường Đại Mỗ, Quận Nam Từ Liêm, Hà Nội",,58.0,181.03,,,Đã có sổ,Đất thổ cư,,
,3.05,"Đồng Mai, Phường Đồng Mai, Quận Hà Đông, Hà Nội",,41.2,74.03,,,Đã có sổ,Đất thổ cư,,
,7.225,"Đường Bãi Dài, Xã Tiến Xuân, Huyện Thạch Thất, Hà Nội",,170.0,42.5,,,Đã có sổ,Đất nền dự án,,
,6.912,"Làng Vàng, Xã Cổ Bi, Huyện Gia Lâm, Hà Nội",,108.0,64.0,,,Đã có sổ,Đất thổ cư,,
,15.75,"Đường Phúc Lợi, Phường Phúc Lợi, Quận Long Biên, Hà Nội",,90.0,175.0,,,Đã có sổ,Đất thổ cư,,
,1.48,"Liên Thôn, Xã Thư Phú, Huyện Thường Tín, Hà Nội",,44.2,33.48,,,Đã có sổ,Đất thổ cư,,
,6.8,"Chúc Lý, Xã Ngọc Hòa, Huyện Chương Mỹ, Hà Nội",,100.0,68.0,,,Đã có sổ,Đất thổ cư,,
,3.55,"Đường Đa Tốn, Xã Đa Tốn, Huyện Gia Lâm, Hà Nội",,58.0,61.21,,,Đã có sổ,Đất thổ cư,,
,3.55,"Đường Đa Tốn, Xã Đa Tốn, Huyện Gia Lâm, Hà Nội",,58.5,60.68,,,Đã có sổ,Đất thổ cư,,
,3.95,"Đường Đào Xuyên, Thị trấn Trâu Quỳ, Huyện Gia Lâm, Hà Nội",,53.0,74.53,,,Đã có sổ,Đất thổ cư,,
,0.5,"Thúy Lĩnh, Phường Lĩnh Nam, Quận Hoàng Mai, Hà Nội",,400.0,1.25,,,Đang chờ sổ,Đất nông nghiệp,,
,1.95,"Đê Tả Đáy, Phường Đồng Mai, Quận Hà Đông, Hà Nội",,32.0,60.94,,,Đã có sổ,Đất thổ cư,,
,3.3,"Đường Dân Sinh , Xã Nam Phương Tiến, Huyện Chương Mỹ, Hà Nội",,892.0,3.7,,,Đã có sổ,Đất thổ cư,,
,8.5,"Đường Huyền Kỳ, Phường Phú Lãm, Quận Hà Đông, Hà Nội",,51.0,166.67,,,Đã có sổ,Đất thổ cư,,
,15.0,"Đường Cự Khối, Phường Cự Khối, Quận Long Biên, Hà Nội",,67.0,223.88,,,Đã có sổ,Đất thổ cư,,
,1.25,"Quảng hội, Xã Quang Tiến, Huyện Sóc Sơn, Hà Nội",,50.0,25.0,,,Đã có sổ,Đất thổ cư,,
,10.3,"Phố Đào Tấn, Phường Cống Vị, Quận Ba Đình, Hà Nội",,65.0,158.46,,,Đã có sổ,Đất thổ cư,,
,2.6,"66, Đường Yên Hòa, Phường Yên Nghĩa, Quận Hà Đông, Hà Nội",,36.0,72.22,,,Đã có sổ,Đất thổ cư,,
,1.8,"liên xã, Xã Hồng Vân, Huyện Thường Tín, Hà Nội",,40.0,45.0,,,Đã có sổ,Đất thổ cư,,
