du_an,price_VND,location,status,area,price_m2,toilet,room,doc,type,Số tầng,furnishing
,16.0,"Đường Lạc Long Quân, Phường Phú Thượng, Quận Tây Hồ, Hà Nội",,57.0,280.7,,,Đã có sổ,Đất thổ cư,,
,7.2,"Đường Nguyễn Văn Linh, Phường Thạch Bàn, Quận Long Biên, Hà Nội",,60.0,120.0,,,Đã có sổ,Đất thổ cư,,
,3.2,"Đường Quang Tiến, Phường Đại Mỗ, Quận Nam Từ Liêm, Hà Nội",,35.0,91.43,,,Đã có sổ,Đất thổ cư,,
,1.25,"Chương Lộc, Xã Chương Dương, Huyện Thường Tín, Hà Nội",,44.0,28.41,,,Đã có sổ,Đất thổ cư,,
,2.106,"Chương Dương, Xã Chương Dương, Huyện Thường Tín, Hà Nội",,73.0,28.85,,,Đã có sổ,Đất thổ cư,,
,8.4,"KIm Chung, Xã Kim Chung, Huyện Đông Anh, Hà Nội",,120.0,70.0,,,Đang chờ sổ,Đất thổ cư,,
,1.895,"Hồng Vân, Xã Hồng Vân, Huyện Thường Tín, Hà Nội",,48.0,39.48,,,Đã có sổ,Đất thổ cư,,
,4.3,"Đường Nguyễn Khê, Xã Nguyên Khê, Huyện Đông Anh, Hà Nội",,60.0,71.67,,,Đã có sổ,Đất thổ cư,,
,2.37,"Chương Dương, Xã Chương Dương, Huyện Thường Tín, Hà Nội",,848.0,2.79,,,Đã có sổ,Đất thổ cư,,
,1.63,"Khoái Cầu, Xã Thắng Lợi, Huyện Thường Tín, Hà Nội",,46.0,35.43,,,Đã có sổ,Đất thổ cư,,
,49.0,"Phố Phú Xá , Phường Phú Thượng, Quận Tây Hồ, Hà Nội",,198.0,247.47,,,Đã có sổ,Đất thổ cư,,
,26.0,"Lê Hữu Tựu, Xã Nguyên Khê, Huyện Đông Anh, Hà Nội",,246.0,105.69,,,Đã có sổ,Đất thổ cư,,
,12.5,"Đường Cao Lỗ, Xã Uy Nỗ, Huyện Đông Anh, Hà Nội",,152.0,82.24,,,Đã có sổ,Đất thổ cư,,
,26.0,"Lê Hữu Tựu, Xã Nguyên Khê, Huyện Đông Anh, Hà Nội",,246.0,105.69,,,Đã có sổ,Đất thổ cư,,
,12.5,"Đường Cao Lỗ, Xã Uy Nỗ, Huyện Đông Anh, Hà Nội",,152.0,82.24,,,Đã có sổ,Đất thổ cư,,
,1.12,"Vân Từ, Xã Vân Từ, Huyện Phú Xuyên, Hà Nội",,65.0,17.23,,,Đã có sổ,Đất thổ cư,,
,8.45,"Phố Xa La, Phường Phúc La, Quận Hà Đông, Hà Nội",,83.0,101.81,,,Đã có sổ,Đất thổ cư,,
,120.0,"Đường An Dương Vương, Phường Phú Thượng, Quận Tây Hồ, Hà Nội",,500.0,240.0,,,Đã có sổ,Đất thổ cư,,
,11.2,"Phố Chùa Quỳnh, Phường Quỳnh Lôi, Quận Hai Bà Trưng, Hà Nội",,70.0,160.0,,,Đã có sổ,Đất thổ cư,,
,15.5,"Đường Nguyễn Chí Thanh, Phường Láng Hạ, Quận Đống Đa, Hà Nội",,60.0,258.33,,,Đã có sổ,Đất thổ cư,,
,1.12,"Vân Từ, Xã Vân Từ, Huyện Phú Xuyên, Hà Nội",,65.0,17.23,,,Đã có sổ,Đất thổ cư,,
,7.3,"ngũ hiệp, Xã Ngũ Hiệp, Huyện Thanh Trì, Hà Nội",,89.3,81.75,,,Đã có sổ,Đất thổ cư,,
,3.15,"Hà Hồi, Xã Hà Hồi, Huyện Thường Tín, Hà Nội",,48.0,65.62,,,Đã có sổ,Đất thổ cư,,
,35.0,"Đường Lê Văn Lương, Phường Nhân Chính, Quận Thanh Xuân, Hà Nội",,170.0,205.88,,,Đã có sổ,Đất thổ cư,,
,4.95,"Đường Hữu Hưng, Phường Đại Mỗ, Quận Nam Từ Liêm, Hà Nội",,60.0,82.5,,,Đã có sổ,Đất thổ cư,,
,15.0,"Đường Nguyễn Chí Thanh, Phường Láng Thượng, Quận Đống Đa, Hà Nội",,60.0,250.0,,,Đã có sổ,Đất thổ cư,,
,3.6,"Đào Duy Tùng, Xã Cổ Loa, Huyện Đông Anh, Hà Nội",,46.0,78.26,,,Đã có sổ,Đất thổ cư,,
,0.995,"Hòa Thượng, Xã Bạch Hạ, Huyện Phú Xuyên, Hà Nội",,80.0,12.44,,,Đã có sổ,Đất thổ cư,,
,1.3,"khuyến lương, Phường Yên Sở, Quận Hoàng Mai, Hà Nội",,120.5,10.79,,,Sổ chung / công chứng vi bằng,Đất thổ cư,,
,1.13,"Hướng Dương, Xã Thắng Lợi, Huyện Thường Tín, Hà Nội",,59.0,19.15,,,Đã có sổ,Đất thổ cư,,
,0.927,"Chợ Vài, Xã Hợp Thanh, Huyện Mỹ Đức, Hà Nội",,106.8,8.68,,,Đã có sổ,Đất thổ cư,,
,0.7,"Đường Mỹ Đình, Phường Mỹ Đình 1, Quận Nam Từ Liêm, Hà Nội",,57.0,12.28,,,Giấy tờ viết tay,Đất nông nghiệp,,
,8.4,"Ngọc Chi, Xã Vĩnh Ngọc, Huyện Đông Anh, Hà Nội",,72.0,116.67,,,Đã có sổ,Đất thổ cư,,
,0.7,"Đường Mỹ Đình, Phường Mỹ Đình 1, Quận Nam Từ Liêm, Hà Nội",,57.0,12.28,,,Giấy tờ viết tay,Đất nông nghiệp,,
,8.4,"Ngọc Chi, Xã Vĩnh Ngọc, Huyện Đông Anh, Hà Nội",,72.0,116.67,,,Đã có sổ,Đất thổ cư,,
,4.05,"Dục Tú, Xã Dục Tú, Huyện Đông Anh, Hà Nội",,44.0,92.05,,,Đã có sổ,Đất thổ cư,,
,5.8,"Đường Bắc Thăng Long - Hải Bối, Xã Hải Bối, Huyện Đông Anh, Hà Nội",,72.0,80.56,,,Đã có sổ,Đất thổ cư,,
,3.9,"Thôn Đoài, Xã Nam Hồng, Huyện Đông Anh, Hà Nội",,57.0,68.42,,,Đã có sổ,Đất thổ cư,,
,5.4,"Thôn Đìa, Xã Nam Hồng, Huyện Đông Anh, Hà Nội",,64.0,84.38,,,Đã có sổ,Đất thổ cư,,
,6.55,"Thuỵ Lâm, Xã Thuỵ Lâm, Huyện Đông Anh, Hà Nội",,88.0,74.43,,,Đã có sổ,Đất nền dự án,,
,4.0,"Vân Nội, Xã Vân Nội, Huyện Đông Anh, Hà Nội",,54.0,74.07,,,Đã có sổ,Đất thổ cư,,
,7.44,"Đường Nguyễn Khê, Xã Nguyên Khê, Huyện Đông Anh, Hà Nội",,80.0,93.0,,,Đã có sổ,Đất nền dự án,,
,4.7,"Việt Hùng, Xã Việt Hùng, Huyện Đông Anh, Hà Nội",,68.0,69.12,,,Đã có sổ,Đất thổ cư,,
,9.7,"Đường Nguyễn Khang, Phường Yên Hoà, Quận Cầu Giấy, Hà Nội",,82.0,118.29,,,Đã có sổ,Đất thổ cư,,
,5.5,"Đường Khương Đình, Phường Hạ Đình, Quận Thanh Xuân, Hà Nội",,40.0,137.5,,,Đã có sổ,Đất thổ cư,,
,3.02,"Đường Hải Bối, Xã Hải Bối, Huyện Đông Anh, Hà Nội",,47.5,63.58,,,Đã có sổ,Đất thổ cư,,
,2.75,"Võ Văn Kiệt, Xã Bắc Hồng, Huyện Đông Anh, Hà Nội",,57.2,48.08,,,Đã có sổ,Đất thổ cư,,
,25.0,"Phố Phú Thượng, Phường Phú Thượng, Quận Tây Hồ, Hà Nội",,131.0,190.84,,,Đã có sổ,Đất thổ cư,,
,7.8,"Đường Kính Nỗ, Xã Uy Nỗ, Huyện Đông Anh, Hà Nội",,100.0,78.0,,,Đã có sổ,Đất thổ cư,,
,2.1,"Quang Minh, Thị trấn Quang Minh, Huyện Mê Linh, Hà Nội",,40.0,52.5,,,Đã có sổ,Đất thổ cư,,
,21.0,"Đường Lâm Hạ, Phường Bồ Đề, Quận Long Biên, Hà Nội",,86.0,244.19,,,Đã có sổ,Đất thổ cư,,
,3.4,"Đường Võ Nguyên Giáp, Xã Nguyên Khê, Huyện Đông Anh, Hà Nội",,55.2,61.59,,,Đã có sổ,Đất thổ cư,,
,10.7,"Vành Đai 3, Xã Bắc Hồng, Huyện Đông Anh, Hà Nội",,183.5,58.31,,,Đã có sổ,Đất thổ cư,,
,3.8,"Đường Phan Trọng Tuệ, Thị trấn Văn Điển, Huyện Thanh Trì, Hà Nội",,44.0,86.36,,,Đã có sổ,Đất thổ cư,,
,109.0,"Đường La Thành, Phường Quang Trung, Thị xã Sơn Tây, Hà Nội",,1720.0,63.37,,,Đã có sổ,Đất thổ cư,,
,8.5,"Đường Lê Trọng Tấn, Phường Dương Nội, Quận Hà Đông, Hà Nội",,50.0,170.0,,,Đã có sổ,Đất thổ cư,,
,3.25,"Đội 2, Xã Tân Xã, Huyện Thạch Thất, Hà Nội",,89.0,36.52,,,Đã có sổ,Đất thổ cư,,
,5.0,"Đường Đào Duy Tùng, Xã Uy Nỗ, Huyện Đông Anh, Hà Nội",,57.0,87.72,,,Đã có sổ,Đất thổ cư,,
,4.6,"Đông Mỹ, Xã Đông Mỹ, Huyện Thanh Trì, Hà Nội",,62.0,74.19,,,Đã có sổ,Đất thổ cư,,
,12.524,"Đường Cầu Giấy, Phường Quan Hoa, Quận Cầu Giấy, Hà Nội",,62.0,202.0,,,Đã có sổ,Đất thổ cư,,
,3.75,"Lê Hữu Tựu, Xã Nguyên Khê, Huyện Đông Anh, Hà Nội",,62.0,60.48,,,Đã có sổ,Đất thổ cư,,
,3.88,"Đường Đa Tốn, Xã Đa Tốn, Huyện Gia Lâm, Hà Nội",,43.0,90.23,,,Đã có sổ,Đất thổ cư,,
,1.95,"Đường Thuỵ Lâm, Xã Thuỵ Lâm, Huyện Đông Anh, Hà Nội",,52.0,37.5,,,Đã có sổ,Đất thổ cư,,
,5.1,"Đường Nhân Huệ, Phường Đồng Mai, Quận Hà Đông, Hà Nội",,63.0,80.95,,,Đã có sổ,Đất thổ cư,,
,21.0,"Đường Lạc Long Quân, Phường Nhật Tân, Quận Tây Hồ, Hà Nội",,75.0,280.0,,,Đã có sổ,Đất thổ cư,,
,12.5,"Đường Thạch Bàn, Phường Thạch Bàn, Quận Long Biên, Hà Nội",,75.0,166.67,,,Đã có sổ,Đất nền dự án,,
,1.375,"Liên thôn, Xã Hoàng Văn Thụ, Huyện Chương Mỹ, Hà Nội",,250.0,5.5,,,Không có sổ,Đất thổ cư,,
,8.0,"Đường Đông Ngạc, Phường Đông Ngạc, Quận Bắc Từ Liêm, Hà Nội",,128.0,62.5,,,Đã có sổ,Đất thổ cư,,
,1.12,"Thống Nhất, Xã Thống Nhất, Huyện Thường Tín, Hà Nội",,46.0,24.35,,,Đã có sổ,Đất thổ cư,,
,6.8,"Quang Lai, Xã Tứ Hiệp, Huyện Thanh Trì, Hà Nội",,32.0,212.5,,,Đã có sổ,Đất thổ cư,,
,6.5,"Phố Võ Thị Sáu, Phường Thanh Nhàn, Quận Hai Bà Trưng, Hà Nội",,54.0,120.37,,,Đã có sổ,Đất thổ cư,,
,3.84,"Đường Bát Khối, Xã Đông Dư, Huyện Gia Lâm, Hà Nội",,41.0,93.66,,,Đã có sổ,Đất thổ cư,,
,1.65,"Thanh Thần, Xã Thanh Cao, Huyện Thanh Oai, Hà Nội",,40.0,41.25,,,Đã có sổ,Đất thổ cư,,
du_an,price_VND,location,status,area,price_m2,toilet,room,doc,type,Số tầng,furnishing
,2.0,", DO HẠ , Xã Tiền Phong, Huyện Mê Linh, Hà Nội",,43.9,45.56,,,Đã có sổ,Đất thổ cư,,
,1.75,"Đường tỉnh 420, Xã Bình Yên, Huyện Thạch Thất, Hà Nội",,61.0,28.69,,,Đã có sổ,Đất thổ cư,,
,3.08,"đường trục kinh tế phía bắc, Xã Cao Thành, Huyện Ứng Hòa, Hà Nội",,114.0,27.02,,,Đã có sổ,Đất thổ cư,,
,7.1,"Đường Đại Mỗ, Phường Đại Mỗ, Quận Nam Từ Liêm, Hà Nội",,52.0,136.54,,,Đã có sổ,Đất thổ cư,,
,15.6,"Phố An Trạch, Phường Quốc Tử Giám, Quận Đống Đa, Hà Nội",,55.0,283.64,,,Đã có sổ,Đất thổ cư,,
,0.073,"Hồ Chí Minh , Xã Tân Tiến, Huyện Chương Mỹ, Hà Nội",,52.0,1.4,,,Đã có sổ,Đất thổ cư,,
,14.1,"34A ngõ 239, Bồ Đề, Phường Bồ Đề, Quận Long Biên, Hà Nội",,135.0,104.44,,,Đã có sổ,Đất thổ cư,,
,5.55,"Nghĩa Lộ, Phường Yên Nghĩa, Quận Hà Đông, Hà Nội",,37.0,150.0,,,Đã có sổ,Đất thổ cư,,
,1.18,"Thôn Trãi, Xã Vân Từ, Huyện Phú Xuyên, Hà Nội",,65.0,18.15,,,Đã có sổ,Đất thổ cư,,
,2.6,"Đường Hòa Bình, Phường Yên Nghĩa, Quận Hà Đông, Hà Nội",,38.0,68.42,,,Đã có sổ,Đất thổ cư,,
,5.75,"Đường Cầu Noi, Phường Cổ Nhuế 2, Quận Bắc Từ Liêm, Hà Nội",,45.0,127.78,,,Đã có sổ,Đất thổ cư,,
,1.47,"Chương Lộc, Xã Chương Dương, Huyện Thường Tín, Hà Nội",,47.3,31.08,,,Đã có sổ,Đất thổ cư,,
,7.62,"La Tinh, Xã Đông La, Huyện Hoài Đức, Hà Nội",,60.0,127.0,,,Đã có sổ,Đất thổ cư,,
,8.967,"La Tinh, Xã Đông La, Huyện Hoài Đức, Hà Nội",,61.0,147.0,,,Đã có sổ,Đất thổ cư,,
,8.932,"La Tinh, Xã Đông La, Huyện Hoài Đức, Hà Nội",,65.2,136.99,,,Đã có sổ,Đất thổ cư,,
,6.15,"Đồng Nhân, Xã Đông La, Huyện Hoài Đức, Hà Nội",,60.0,102.5,,,Đã có sổ,Đất thổ cư,,
,5.5,"La Tinh, Xã Đông La, Huyện Hoài Đức, Hà Nội",,50.0,110.0,,,Đã có sổ,Đất thổ cư,,
,2.45,"Thuỵ Hà, Xã Bắc Hồng, Huyện Đông Anh, Hà Nội",,74.0,33.11,,,Đã có sổ,Đất thổ cư,,
,1.97,"Vụ Bản, Xã Minh Trí, Huyện Sóc Sơn, Hà Nội",,85.0,23.18,,,Đã có sổ,Đất thổ cư,,
,17.3,"14, Ngách 268/58 Đường Ngọc Thụy, Phường Ngọc Thụy, Quận Long Biên, Hà Nội",,77.5,223.23,,,Đã có sổ,Đất thổ cư,,
,17.3,"14, Ngách 268/58 Đường Ngọc Thụy, Phường Ngọc Thụy, Quận Long Biên, Hà Nội",,77.5,223.23,,,Đã có sổ,Đất thổ cư,,
,2.08,"Xâm Thị, Xã Hồng Vân, Huyện Thường Tín, Hà Nội",,62.0,33.55,,,Đã có sổ,Đất thổ cư,,
,1.354,"Đông nam, Xã Nam Phương Tiến, Huyện Chương Mỹ, Hà Nội",,80.0,16.93,,,Đã có sổ,Đất thổ cư,,
,2.4,"Quốc Lộ 23b, Xã Vân Nội, Huyện Đông Anh, Hà Nội",,40.0,60.0,,,Đã có sổ,Đất thổ cư,,
,0.222222,"Đường tỉnh 420, Xã Bình Yên, Huyện Thạch Thất, Hà Nội",,67.7,3.28,,,Đã có sổ,Đất thổ cư,,
,10.36,"Phố Huỳnh Thúc Kháng, Phường Yết Kiêu, Quận Hà Đông, Hà Nội",,52.0,199.23,,,Đã có sổ,Đất thổ cư,,
,7.5,"292, Ngõ 292 Đường Hà Huy Tập, Thị trấn Yên Viên, Huyện Gia Lâm, Hà Nội",,115.0,65.22,,,Sổ chung / công chứng vi bằng,Đất thổ cư,,
,1.25,"Đường Quốc lộ 21, Xã Bình Yên, Huyện Thạch Thất, Hà Nội",,65.0,19.23,,,Đã có sổ,Đất thổ cư,,
,2.53,"Thôn Đình Trung, Lê Hữu Tựu, Xã Xuân Nộn, Huyện Đông Anh, Hà Nội",,51.0,49.61,,,Đã có sổ,Đất thổ cư,,
,1.5,"định công hạ, Phố Định Công Hạ, Phường Định Công, Quận Hoàng Mai, Hà Nội",,38.0,39.47,,,Sổ chung / công chứng vi bằng,Đất nông nghiệp,,
,2.2,"Đường Đồng Dương, Phường Đồng Mai, Quận Hà Đông, Hà Nội",,40.0,55.0,,,Đã có sổ,Đất thổ cư,,
,4.25,"Đường 418, Xã Sơn Đông, Thị xã Sơn Tây, Hà Nội",,770.0,5.52,,,Đã có sổ,Đất thổ cư,,
,5.1,"thanh am, Phường Ngọc Thụy, Quận Long Biên, Hà Nội",,32.0,159.38,,,Đã có sổ,Đất thổ cư,,
,1.4,"Hồ Chí Minh, Xã Thủy Xuân Tiên, Huyện Chương Mỹ, Hà Nội",,124.0,11.29,,,Đã có sổ,Đất thổ cư,,
,2.4,"Đường Cổ Bản - Nhân Sơn, Phường Đồng Mai, Quận Hà Đông, Hà Nội",,50.0,48.0,,,Đã có sổ,Đất thổ cư,,
,3.1,"Phố Phúc Tiến, Phường Biên Giang, Quận Hà Đông, Hà Nội",,52.5,59.05,,,Đã có sổ,Đất thổ cư,,
,16.0,", Đường trục phía Nam, Phường Kiến Hưng, Quận Hà Đông, Hà Nội",,200.0,80.0,,,3,Đất nền dự án,,
,4.8,"Ngũ Hiệp, Xã Ngũ Hiệp, Huyện Thanh Trì, Hà Nội",,68.0,70.59,,,Đã có sổ,Đất thổ cư,,
,2.6,"Đường Yên Thường, Xã Yên Thường, Huyện Gia Lâm, Hà Nội",,45.0,57.78,,,Đã có sổ,Đất thổ cư,,
,5.835,"Phố Thanh Lân, Phường Thanh Trì, Quận Hoàng Mai, Hà Nội",,73.0,79.93,,,Đã có sổ,Đất thổ cư,,
,10.5,"Đường Xuân Đỉnh, Phường Xuân Đỉnh, Quận Bắc Từ Liêm, Hà Nội",,55.6,188.85,,,Đã có sổ,Đất thổ cư,,
,7.6,"Phố Phú Thượng, Phường Phú Thượng, Quận Tây Hồ, Hà Nội",,40.0,190.0,,,Đã có sổ,Đất thổ cư,,
,27.9,"Phố Đỗ Nhuận, Phường Xuân Đỉnh, Quận Bắc Từ Liêm, Hà Nội",,112.0,249.11,,,Đã có sổ,Đất thổ cư,,
,2.98,"Ngõ 12 Phố Châu Đài, Phường Thượng Cát, Quận Bắc Từ Liêm, Hà Nội",,38.0,78.42,,,Đã có sổ,Đất thổ cư,,
,1.65," tân an, Xã Thụy Hương, Huyện Chương Mỹ, Hà Nội",,50.0,33.0,,,Đã có sổ,Đất thổ cư,,
,2.7,"duọc thuong, Xã Tiên Dược, Huyện Sóc Sơn, Hà Nội",,98.0,27.55,,,Đã có sổ,Đất thổ cư,,
,1.38,"Chiều Đông, Xã Tân Minh, Huyện Thường Tín, Hà Nội",,44.0,31.36,,,Đã có sổ,Đất thổ cư,,
,0.699,"Chợ gỗ Văn Tự, Xã Văn Tự, Huyện Thường Tín, Hà Nội",,576.0,0.001213,,,Đã có sổ,Đất nông nghiệp,,
,1.7,"Xâm xuyên, Xã Hồng Vân, Huyện Thường Tín, Hà Nội",,48.0,35.42,,,Đã có sổ,Đất thổ cư,,
,1.38,"Tự Nhiên, Xã Tự Nhiên, Huyện Thường Tín, Hà Nội",,42.0,32.86,,,Đã có sổ,Đất thổ cư,,
,5.4,"thôn Đìa, Xã Nam Hồng, Huyện Đông Anh, Hà Nội",,82.0,65.85,,,Đã có sổ,Đất thổ cư,,
,5.3,"Phố Văn Trì, Phường Minh Khai, Quận Bắc Từ Liêm, Hà Nội",,45.0,117.78,,,Đã có sổ,Đất thổ cư,,
,19.0,"Đường Đặng Thai Mai, Phường Quảng An, Quận Tây Hồ, Hà Nội",,39.0,487.18,,,Đã có sổ,Đất thổ cư,,
,15.0,"Đường Xuân Đỉnh, Phường Xuân Đỉnh, Quận Bắc Từ Liêm, Hà Nội",,79.0,189.87,,,Đã có sổ,Đất thổ cư,,
,9.1,"LÊ TRỌNG TẤN, Phường La Khê, Quận Hà Đông, Hà Nội",,57.0,159.65,,,Đã có sổ,Đất thổ cư,,
,4.8,"Phố Phan Đình Giót, Phường La Khê, Quận Hà Đông, Hà Nội",,40.0,120.0,,,Đã có sổ,Đất thổ cư,,
,13.8,"Đường Lạc Long Quân, Phường Nhật Tân, Quận Tây Hồ, Hà Nội",,74.0,186.49,,,Đã có sổ,Đất thổ cư,,
,6.25,"Nghĩa Bình, Phường Yên Nghĩa, Quận Hà Đông, Hà Nội",,55.0,113.64,,,Đã có sổ,Đất thổ cư,,
,1.28,"Quốc Lộ 6, Thị trấn Chúc Sơn, Huyện Chương Mỹ, Hà Nội",,60.0,21.33,,,Đã có sổ,Đất thổ cư,,
,22.9,"Phố Nguyễn Văn Hưởng, Phường Giang Biên, Quận Long Biên, Hà Nội",,109.0,210.09,,,Đã có sổ,Đất thổ cư,,
,6.8,"Thôn Bài - yên Bài, Xã Yên Bài, Huyện Ba Vì, Hà Nội",,2330.0,2.92,,,Đã có sổ,Đất thổ cư,,
,9.35,"Quốc lộ 35, Xã Bắc Sơn, Huyện Sóc Sơn, Hà Nội",,1100.0,8.5,,,Đã có sổ,Đất thổ cư,,
,1.0,"Quốc lộ 6, Thị trấn Chúc Sơn, Huyện Chương Mỹ, Hà Nội",,50.0,20.2,,,Đã có sổ,Đất thổ cư,,
,2.0,"ql6, Xã Phú Nghĩa, Huyện Chương Mỹ, Hà Nội",,45.5,43.96,,,Đã có sổ,Đất thổ cư,,
,9.8,"Đường Ngọc Thụy, Phường Ngọc Thụy, Quận Long Biên, Hà Nội",,58.0,168.97,,,Đã có sổ,Đất thổ cư,,
,1.6,"131, Xã Hiền Ninh, Huyện Sóc Sơn, Hà Nội",,63.0,25.4,,,Đã có sổ,Đất thổ cư,,
,2.7,"Bắc Hồng, Xã Bắc Hồng, Huyện Đông Anh, Hà Nội",,45.0,60.0,,,Đã có sổ,Đất thổ cư,,
,1.38,"Tự Nhiên, Xã Tự Nhiên, Huyện Thường Tín, Hà Nội",,42.0,32.86,,,Đã có sổ,Đất thổ cư,,
,3.23,"Thôn Đìa, Nam Hồng, Xã Nam Hồng, Huyện Đông Anh, Hà Nội",,61.0,52.95,,,Đã có sổ,Đất thổ cư,,
,3.4,"Tiên Dương, Xã Tiên Dương, Huyện Đông Anh, Hà Nội",,90.0,37.78,,,Đã có sổ,Đất thổ cư,,
,6.104,"N1, Xã Hạ Mỗ, Huyện Đan Phượng, Hà Nội",,76.3,80.0,,,Đã có sổ,Đất thổ cư,,
,8.47,"N1, Xã Hạ Mỗ, Huyện Đan Phượng, Hà Nội",,77.0,110.0,,,Đã có sổ,Đất thổ cư,,
,5.1,"Phố Kẻ Tạnh, Phường Giang Biên, Quận Long Biên, Hà Nội",,30.0,170.0,,,Đã có sổ,Đất thổ cư,,
,5.7,"Phố Kẻ Tạnh, Phường Giang Biên, Quận Long Biên, Hà Nội",,40.0,142.5,,,Đã có sổ,Đất thổ cư,,
,12.8,"Đường Ngọc Thụy, Phường Ngọc Thụy, Quận Long Biên, Hà Nội",,75.0,170.67,,,Đã có sổ,Đất thổ cư,,
,7.45,"Ngõ 34 Ngô Quyền, Phường La Khê, Quận Hà Đông, Hà Nội",,36.0,206.94,,,Đã có sổ,Đất thổ cư,,
,2.7,"Đinh Tiên Hoàng, Xã Hà Hồi, Huyện Thường Tín, Hà Nội",,95.0,28.42,,,Đã có sổ,Đất thổ cư,,
,9.5,"32, Thị trấn Phùng, Huyện Đan Phượng, Hà Nội",,80.0,118.75,,,Đã có sổ,Đất thổ cư,,
,65.0,"Đường Xuân Đỉnh, Phường Xuân Tảo, Quận Bắc Từ Liêm, Hà Nội",,440.0,147.73,,,Đã có sổ,Đất thổ cư,,
,4.0,"Phố An Thượng, Xã Đức Thượng, Huyện Hoài Đức, Hà Nội",,40.0,100.0,,,Đã có sổ,Đất thổ cư,,
du_an,price_VND,location,status,area,price_m2,toilet,room,doc,type,Số tầng,furnishing
,8.0,"Đường Đông Ngạc, Phường Đông Ngạc, Quận Bắc Từ Liêm, Hà Nội",,128.0,62.5,,,Đã có sổ,Đất thổ cư,,
,1.12,"Thống Nhất, Xã Thống Nhất, Huyện Thường Tín, Hà Nội",,46.0,24.35,,,Đã có sổ,Đất thổ cư,,
,6.8,"Quang Lai, Xã Tứ Hiệp, Huyện Thanh Trì, Hà Nội",,32.0,212.5,,,Đã có sổ,Đất thổ cư,,
,6.5,"Phố Võ Thị Sáu, Phường Thanh Nhàn, Quận Hai Bà Trưng, Hà Nội",,54.0,120.37,,,Đã có sổ,Đất thổ cư,,
,3.84,"Đường Bát Khối, Xã Đông Dư, Huyện Gia Lâm, Hà Nội",,41.0,93.66,,,Đã có sổ,Đất thổ cư,,
,1.65,"Thanh Thần, Xã Thanh Cao, Huyện Thanh Oai, Hà Nội",,40.0,41.25,,,Đã có sổ,Đất thổ cư,,
,14.0,"Phố La Dương, Phường Dương Nội, Quận Hà Đông, Hà Nội",,50.0,280.0,,,Đã có sổ,Đất thổ cư,,
,1.28,"Khai Thai, Xã Khai Thái, Huyện Phú Xuyên, Hà Nội",,60.0,21.33,,,Đã có sổ,Đất thổ cư,,
,9.25,"Đường Trần Cung, Phường Cổ Nhuế 1, Quận Bắc Từ Liêm, Hà Nội",,33.0,280.3,,,Đã có sổ,Đất thổ cư,,
,0.95,"Đường An Dương Vương, Phường Phú Thượng, Quận Tây Hồ, Hà Nội",,62.0,15.32,,,Sổ chung / công chứng vi bằng,Đất nông nghiệp,,
,6.75,"Đường Đại Mỗ, Phường Đại Mỗ, Quận Nam Từ Liêm, Hà Nội",,51.3,131.58,,,Đã có sổ,Đất thổ cư,,
,5.55,"Phố Ỷ La, Phường Dương Nội, Quận Hà Đông, Hà Nội",,63.0,88.1,,,Đã có sổ,Đất thổ cư,,
,7.35,"Đường Dương Nội, Phường Dương Nội, Quận Hà Đông, Hà Nội",,65.0,113.08,,,Đã có sổ,Đất thổ cư,,
,7.3,"Ngõ 80 Đường La Nội, Phường Dương Nội, Quận Hà Đông, Hà Nội",,62.0,117.74,,,Đã có sổ,Đất thổ cư,,
,4.525,"LH: 0928821668, Chương Dương, Xã Chương Dương, Huyện Thường Tín, Hà Nội",,181.0,25.0,,,Đã có sổ,Đất thổ cư,,
,4.4,"Phố Ỷ La, Phường Dương Nội, Quận Hà Đông, Hà Nội",,36.0,122.22,,,Đã có sổ,Đất thổ cư,,
,3.05,"Đường Đa Tốn, Xã Đa Tốn, Huyện Gia Lâm, Hà Nội",,40.5,75.31,,,Đã có sổ,Đất thổ cư,,
,2.66,"Đường Thụy Phương, Phường Thụy Phương, Quận Bắc Từ Liêm, Hà Nội",,38.0,70.0,,,Đã có sổ,Đất thổ cư,,
,4.8,"Đường Thụy Phương, Phường Thụy Phương, Quận Bắc Từ Liêm, Hà Nội",,50.0,96.0,,,Đã có sổ,Đất thổ cư,,
,11.0,"Đường Thụy Phương, Phường Thụy Phương, Quận Bắc Từ Liêm, Hà Nội",,176.0,62.5,,,Đã có sổ,Đất thổ cư,,
,9.1,"Đường Lê Đức Thọ, Phường Mỹ Đình 1, Quận Nam Từ Liêm, Hà Nội",,54.0,168.52,,,Đã có sổ,Đất thổ cư,,
,7.35,"Đường Hoàng Trình Thanh, Phường Kiến Hưng, Quận Hà Đông, Hà Nội",,34.0,216.18,,,Đã có sổ,Đất thổ cư,,
,2.75,"Võ Nguyên Giáp, Xã Bắc Hồng, Huyện Đông Anh, Hà Nội",,57.2,48.08,,,Đã có sổ,Đất thổ cư,,
,5.0,"Đào Duy Tùng, Xã Uy Nỗ, Huyện Đông Anh, Hà Nội",,56.8,88.03,,,Đã có sổ,Đất thổ cư,,
,6.85,"Đường Hồ Tùng Mậu, Phường Mai Dịch, Quận Cầu Giấy, Hà Nội",,55.0,124.55,,,Đã có sổ,Đất thổ cư,,
,4.17,"Đường Cổ Loa, Xã Cổ Loa, Huyện Đông Anh, Hà Nội",,51.6,80.81,,,Đã có sổ,Đất thổ cư,,
,5.7,"Phố Kẻ Tạnh, Phường Giang Biên, Quận Long Biên, Hà Nội",,40.0,142.5,,,Đã có sổ,Đất thổ cư,,
,3.45,"Quốc Lộ 23B, Xã Tiên Dương, Huyện Đông Anh, Hà Nội",,47.0,73.4,,,Đã có sổ,Đất thổ cư,,
,6.85,"Quang Lai, Xã Tứ Hiệp, Huyện Thanh Trì, Hà Nội",,35.0,195.71,,,Đã có sổ,Đất thổ cư,,
,3.5,"Đường Việt Hùng, Xã Việt Hùng, Huyện Đông Anh, Hà Nội",,50.0,70.0,,,Đã có sổ,Đất thổ cư,,
,8.0,"Đường Lạc Long Quân, Phường Nghĩa Đô, Quận Cầu Giấy, Hà Nội",,30.0,266.67,,,Đã có sổ,Đất thổ cư,,
,2.6,"Đường Mai Lâm, Xã Mai Lâm, Huyện Đông Anh, Hà Nội",,42.5,61.18,,,Đã có sổ,Đất thổ cư,,
,6.25,"Đường Đê La Thành, Phường Phương Liên, Quận Đống Đa, Hà Nội",,85.0,73.53,,,Đang chờ sổ,Đất thổ cư,,
,1.22,"Xóm 1, Xã Chương Dương, Huyện Thường Tín, Hà Nội",,50.0,24.4,,,Đã có sổ,Đất thổ cư,,
,1.12,"Thôn Trãi, Xã Vân Từ, Huyện Phú Xuyên, Hà Nội",,65.0,17.23,,,Đã có sổ,Đất thổ cư,,
,13.7,"Phố Văn Phú, Phường Phú La, Quận Hà Đông, Hà Nội",,50.0,274.0,,,Đã có sổ,Đất thổ cư,,
,10.0,"Phú Ninh Minh Phú Sóc Sơn Hà Nội , Xã Phú Minh, Huyện Sóc Sơn, Hà Nội",,353.0,28.33,,,Đã có sổ,Đất thổ cư,,
,7.5,"La Tinh, Xã Đông La, Huyện Hoài Đức, Hà Nội",,60.0,125.0,,,Đã có sổ,Đất thổ cư,,
,6.2,"Đường Đa Sỹ, Phường Kiến Hưng, Quận Hà Đông, Hà Nội",,40.0,155.0,,,Đã có sổ,Đất thổ cư,,
,8.5,"Nghĩa Lộ, Phường Yên Nghĩa, Quận Hà Đông, Hà Nội",,59.0,144.07,,,Đã có sổ,Đất thổ cư,,
,8.5,"Nghĩa Lộ, Phường Yên Nghĩa, Quận Hà Đông, Hà Nội",,59.0,144.07,,,Đã có sổ,Đất thổ cư,,
,64.8,"Đường Nguyễn Chí Thanh, Phường Láng Hạ, Quận Đống Đa, Hà Nội",,358.0,181.01,,,Đã có sổ,Đất thổ cư,,
,9.6,"23b, Xã Kim Chung, Huyện Đông Anh, Hà Nội",,147.7,65.0,,,Đã có sổ,Đất thổ cư,,
,0.81,Hợp Thanh,,60.0,13.5,,,Đã có sổ,Đất thổ cư,,
,12.95,"Phố Phú Xá, Phường Phú Thượng, Quận Tây Hồ, Hà Nội",,108.0,119.91,,,Đã có sổ,Đất thổ cư,,
,9.6,"Đường Văn Tiến Dũng, Phường Phúc Diễn, Quận Bắc Từ Liêm, Hà Nội",,67.0,143.28,,,Đã có sổ,Đất thổ cư,,
,2.4,"Mạch Lũng, Xã Đại Mạch, Huyện Đông Anh, Hà Nội",,45.0,53.33,,,Đã có sổ,Đất thổ cư,,
,6.8,"Đường Bát Khối, Xã Đông Dư, Huyện Gia Lâm, Hà Nội",,70.0,97.14,,,Đã có sổ,Đất thổ cư,,
,1.7,"Cổ Đông, Xã Cổ Đông, Thị xã Sơn Tây, Hà Nội",,200.0,8.5,,,Đã có sổ,Đất thổ cư,,
,7.86,"Phố Tư Đình, Phường Long Biên, Quận Long Biên, Hà Nội",,50.0,157.2,,,Đã có sổ,Đất thổ cư,,
